author,book,text
eraghi,divane,"
هر سحر صد ناله و زاری کنم پیش صبا
تا ز من پیغامی آرد بر سر کوی شما
باد می‌پیمایم و بر باد عمری می‌دهم
ورنه بر خاک در تو ره کجا یابد صبا؟
چون ندارم همدمی، با باد می‌گویم سخن
چون نیابم مرهمی، از باد می‌جویم شفا
آتش دل چون نمی‌گردد به آب دیده کم
می‌دمم بادی بر آتش، تا بَتَر سوزد مرا
تا مگر خاکستری گردم به بادی بر شوم
وا رَهَم زین تنگنای محنت آباد بلا
مردن و خاکی شدن بهتر که بی تو زیستن
سوختن خوشتر بسی کز روی تو گردم جدا
خود ندارد بی‌رخ تو زندگانی قیمتی
زندگانی بی‌رخ تو مرگ باشد با عنا
ای مرا یک بارگی از خویشتن کرده جدا
گر بدآن شادی که دور از تو بمیرم مرحبا
دل ز غم رنجور و تو فارغ ازو وز حال ما
بازپرس آخر که: چون شد حال آن بیمار ما؟
شب خیالت گفت با جانم که: چون شد حال دل؟
نعره زد جانم که: ای مسکین، بقا بادا تو را
دوستان را زار کشتی ز آرزوی روی خود
در طریق دوستی آخر کجا باشد روا؟
بود دل را با تو آخر آشنایی پیش ازین
این کند هرگز؟ که کرد این آشنا با آشنا؟
هم چنان در خاک و خون غلتانش باید جان سپرد
خسته‌ای کامید دارد از نکورویان وفا
روز و شب خونابه‌اش باید فشاندن بر درت
دیده‌ای کز خاک درگاه تو جوید توتیا
دل برفت از دست وز تیمار تو خون شد جگر
نیم جانی ماند و آن هم ناتوانی، گو بر آ
از عراقی دوش پرسیدم که: چون است حال تو؟
گفت: چون باشد کسی کز دوستان باشد جدا؟
این حادثه بین که زاد ما را
وین واقعه کاوفتاد ما را
آن یار، که در میان جان است
بر گوشهٔ دل نهاد ما را
در خانهٔ ما نمی‌نهد پای
از دست مگر بداد ما را؟
روزی به سلام یا پیامی
آن یار نکرد یاد ما را
دانست که در غمیم بی او
از لطف نکرد شاد ما را
بر ما در لطف خود فرو بست
وز هجر دری گشاد ما را
خود مادر روزگار گویی
کز بهر فراق زاد ما را
ای کاش نزادی، ای عراقی
کز توست همه فساد ما را
کشیدم رنج بسیاری دریغا
به کام من نشد کاری دریغا
به عالم، در که دیدم باز کردم
ندیدم روی دلداری دریغا
شدم نومید کاندر چشم امید
نیامد خوب رخساری دریغا
ندیدم هیچ گلزاری به عالم
که در چشمم نزد خاری دریغا
مرا یاری است کز من یاد نارد
که دارد این چنین یاری؟ دریغا
دل بیمار من بیند نپرسد
که چون شد حال بیماری؟ دریغا
شدم صدبار بر درگاه وصلش
ندادم بار یک باری دریغا
ز اندوه فراقش بر دل من
رسد هر لحظه تیماری دریغا
به سر شد روزگارم بی‌رخ تو
نماند از عمر بسیاری دریغا
نپرسد از عراقی، تا بمیرد
جهان گوید که: مرد، آری دریغا
ندیدم در جهان کامی دریغا
بماندم بی‌سرانجامی دریغا
گوارنده نشد از خوان گیتی
مرا جز غصه‌آشامی دریغا
نشد از بزم وصل خوبرویان
نصیب بخت من جامی دریغا
مرا دور از رخ دلدار دردی است
که آن را نیست آرامی دریغا
فرو شد روز عمر و بر نیامد
از آن شیرین لبش کامی دریغا
درین امید عمرم رفت کاخر:
کند یادم به پیغامی دریغا
چو وادیدم عراقی نزد آن دوست
نمی‌ارزد به دشنامی دریغا
سر به سر از لطف جانی ساقیا
خوشتر از جان چیست؟ آنی ساقیا
میل جان‌ها جمله سوی روی توست
رو، که شیرین دلستانی ساقیا
زان به چشم من درآیی هر زمان
کز صفا آب روانی ساقیا
از می عشق ار چه سرمستی، مکن
با حریفان سرگرانی ساقیا
وعده‌ای می‌ده، اگر چه کج بود
کز بهانه در گمانی ساقیا
بر لب خود بوسه ده، آنگه ببین
ذوق آب زندگانی ساقیا
از لطافت در نیابد کس تو را
زان یقینم شد که جانی ساقیا
گوش جان‌ها پر گهر شد، زانکه تو
از سخن در می‌چکانی ساقیا
در دل و چشمم ز حسن و لطف خویش
آشکارا و نهانی ساقیا
نیست در عالم عراقی را دمی
بر لب تو کامرانی ساقیا
ای ز فروغ رخت تافته صد آفتاب
تافته‌ام از غمت، روی ز من بر متاب
زنده به بوی توام، بوی ز من وامگیر
تشنهٔ روی توام، باز مدار از من آب
از رخ سیراب خود بر جگرم آب زن
کز تپش تشنگی شد جگر من سراب
تافته اندر دلم پرتو مهر رخت
می‌کنم از آب چشم خانهٔ دل را خراب
روز ار آید به شب بی رخ تو چه عجب؟
روز چگونه بود چون نبود آفتاب؟
چون به سر کوی تو نیست تنم را مقام
چون به بر لطف تو نیست دلم را مآب
فخر عراقی به توست، عار چه داری ازو؟
نیک و بد و هرچه هست، هست بتوش انتساب"
eraghi,divane,"
مست خراب یابد هر لحظه در خرابات
گنجی که آن نیابد صد پیر در مناجات
خواهی که راه یابی بی‌رنج بر سر گنج
می‌بیز هر سحرگاه خاک در خرابات
یک ذره گرد از آن خاک در چشم جانت افتد
با صدهزار خورشید افتد تو را ملاقات
ور عکس جام باده ناگاه بر تو تابد
نز خویش گردی آگه، نز جام، نز شعاعات
در بیخودی و مستی جایی رسی، که آنجا
در هم شود عبادات، پی گم کند اشارات
تا گم نگردی از خود گنجی چنین نیابی
حالی چنین نیابد گم گشته از ملاقات
تا کی کنی به عادت در صومعه عبادت؟
کفر است زهد و طاعت تا نگذری ز میقات
تا تو ز خودپرستی وز جست وجو نرستی
می‌دان که می‌پرستی در دیر عزی و لات
در صومعه تو دانی می‌کوش تا توانی
در میکده رها کن از سر فضول و طامات
جان باز در خرابات، تا جرعه‌ای بیابی
مفروش زهد، کانجا کمتر خرند طامات
لب تشنه چند باشی، در ساحل تمنی؟
انداز خویشتن را در بحر بی‌نهایات
تا گم شود نشانت در پای بی‌نشانی
تا در کشد به کامت یک ره نهنگ حالات
چون غرقه شد عراقی یابد حیات باقی
اسرار غیب بیند در عالم شهادات
دیدی چو من خرابی افتاده در خرابات
فارغ شده ز مسجد وز لذت مباحات
از خانقاه رفته، در میکده نشسته
صد سجده کرده هر دم در پیش عزی و لات
در باخته دل و دین، مفلس بمانده مسکین
افتاده خوار و غمگین در گوشهٔ خرابات
نی همدمی که با او یک دم دمی برآرد
نی محرمی که یابد با وی دمی مراعات
نی هیچ گبری او را دستی گرفت روزی
نی کرده پایمردی با او دمی مدارات
دردش ندید درمان، زخمش نجست مرهم
در ساخته به ناکام با درد بی‌مداوات
خوش بود روزگاری بر بوی وصل یاری
هم خوشدلیش رفته، هم روزگار، هیهات!
با این همه، عراقی، امیدوار می‌باش
باشد که به شود حال، گردنده است حالات
به یک گره که دو چشمت بر ابروان انداخت
هزار فتنه و آشوب در جهان انداخت
فریب زلف تو با عاشقان چه شعبده ساخت؟
که هر که جان و دلی داشت در میان انداخت
دلم، که در سر زلف تو شد، توان گه گه
ز آفتاب رخت سایه‌ای بر آن انداخت
رخ تو در خور چشم من است، لیک چه سود
که پرده از رخ تو برنمی‌توان انداخت
حلاوت لب تو، دوش، یاد می‌کردم
بسا شکر که در آن لحظه در دهان انداخت
من از وصال تو دل برگرفته بودم، لیک
زبان لطف توام باز در گمان انداخت
قبول تو دگران را به صدر وصل نشاند
دل شکستهٔ ما را بر آستان انداخت
چه قدر دارد، جانا، دلی؟ توان هردم
بر آستان درت صدهزار جان انداخت
عراقی از دل و جان آن زمان امید برید
که چشم جادوی تو چین در ابروان انداخت
چو آفتاب رخت سایه بر جهان انداخت
جهان کلاه ز شادی بر آسمان انداخت
سپاه عشق تو از گوشه‌ای کمین بگشود
هزار فتنه و آشوب در جهان انداخت
حدیث حسن تو، هر جا که در میان آمد
ز ذوق، هر که دلی داشت، در میان انداخت
قبول تو همه کس را بر آشیان جا کرد
مرا ز بهر چه آخر بر آستان انداخت؟
چو در سماع عراقی حدیث دوست شنید
بجای خرقه به قوال جان توان انداخت
عراقی بار دیگر توبه بشکست
ز جام عشق شد شیدا و سرمست
پریشان سر زلف بتان شد
خراب چشم خوبان است پیوست
چه خوش باشد خرابی در خرابات
گرفته زلف یار و رفته از دست
ز سودای پریرویان عجب نیست
اگر دیوانه‌ای زنجیر بگسست
به گرد زلف مهرویان همی گشت
چو ماهی ناگهان افتاد در شست
به پیران سر، دل و دین داد بر باد
ز خود فارغ شد و از جمله وارست
سحرگه از سر سجاده برخاست
به بوی جرعه‌ای زنار بربست
ز بند نام و ننگ آنگه شد آزاد
که دل را در سر زلف بتان بست
بیفشاند آستین بر هردو عالم
قلندروار در میخانه بنشست
لب ساقی صلای بوسه در داد
عراقی توبهٔ سی‌ساله بشکست
ساقی قدحی شراب در دست
آمد ز شراب خانه سرمست
آن توبهٔ نادرست ما را
همچون سر زلف خویش بشکست
از مجلسیان خروش برخاست
کان فتنهٔ روزگار بنشست
ماییم کنون و نیم جانی
و آن نیز نهاده بر کف دست
آن دل، که ازو خبر نداریم
هم در سر زلف اوست گر هست
دیوانهٔ روی اوست دایم
آشفتهٔ موی اوست پیوست
در سایهٔ زلف او بیاسود
وز نیک و بد زمانه وارست
چون دید شعاع روی خوبش
در حال ز سایه رخت بربست
در سایه مجو دل عراقی
کان ذره به آفتاب پیوست"
eraghi,divane,"
از پرده برون آمد، ساقی، قدحی در دست
هم پردهٔ ما بدرید، هم توبهٔ ما بشکست
بنمود رخ زیبا، گشتیم همه شیدا
چون هیچ نماند از ما آمد بر ما بنشست
زلفش گرهی بگشاد بند از دل ما برخاست
جان دل ز جهان برداشت وندر سر زلفش بست
در دام سر زلفش ماندیم همه حیران
وز جام می لعلش گشتیم همه سرمست
از دست بشد چون دل در طرهٔ او زد چنگ
غرقه زند از حیرت در هرچه بیابد دست
چون سلسلهٔ زلفش بند دل حیران شد
آزاد شد از عالم وز هستی ما وارست
دل در سر زلفش شد، از طره طلب کردم
گفتا که: لب او خوش اینک سرِ ما پیوست
با یار خوشی بنشست دل کز سر جان برخاست
با جان و جهان پیوست دل کز دو جهان بگسست
از غمزهٔ روی او گه مستم و گه هشیار
وز طرهٔ لعل او گه نیستم و گه هست
می‌خواستم از اسرار اظهار کنم حرفی
ز اغیار بترسیدم گفتم سخن سر بست
دو اسبه پیک نظر می‌دوانم از چپ و راست
به جست و جوی نگاری، که نور دیدهٔ ماست
مرا، که جز رخ او در نظر نمی‌آید
دو دیده از هوس روی او پر آب چراست؟
چو غرق آب حیاتم چه آب می‌جویم؟
چو با من است نگارم چه می‌دوم چپ و راست؟
نگاه کردم و در خود همه تو را دیدم
نظر چنین نکند آن که او به خود بیناست
به نور طلعت تو یافتم وجود تو را
به آفتاب توان دید کآفتاب کجاست؟
ز روی روشن هر ذره شد مرا روشن
که آفتاب رخت در همه جهان پیداست
به قامت خوش خوبان نگاه می‌کردم
لباس حسن تو دیدم به قد هریک راست
شمایل تو بدیدم ز قامت شمشاد
ازین سپس کشش من همه سوی بالاست
شگفت نیست که در بند زلف توست دلم
که هرکجا که دلی هست اندر آن سوداست
به غمزه گر نربودی دل همه عالم
ز عشق تو دل جمله جهان چرا شیداست؟
وگر جمال تو با عاشقان کرشمه نکرد
ز بهر چه شر و آشوب از جهان برخاست؟
ور از جهان سخن سر تو برون افتاد
سزد، که راز نگه داشتن نه کار صداست
ندید چشم عراقی تو را، چنان که تویی
از آن که در نظرش جمله کاینات هباست
شوری ز شرابخانه برخاست
برخاست غریوی از چپ و راست
تا چشم بتم چه فتنه انگیخت؟
کز هر طرفی هزار غوغاست
تا جام لبش کدام می داد؟
کز جرعه‌اش هر که هست شیداست
ساقی، قدحی، که مست عشقم
و آن باده هنوز در سر ماست
آن نعرهٔ شور هم‌چنان هست
وآن شیفتگی هنوز برجاست
کارم، که چو زلف توست در هم
بی‌قامت تو نمی‌شود راست
مقصود تویی مرا ز هستی
کز جام، غرض می مصفاست
آیینهٔ روی توست جانم
عکس رخ تو درو هویداست
گل رنگ رخ تو دارد ، ارنه
رنگ رخش از پی چه زیباست ؟
ور سرو نه قامت تو دیده است
او را کشش از چه سوی بالاست؟
باغی است جهان، ز عکس رویت
خرم دل آن که در تماشاست
در باغ همه رخ تو بیند
از هر ورق گل، آن که بیناست
از عکس رخت دل عراقی
گلزار و بهار و باغ و صحراست
از میکده تا چه شور برخاست؟
کاندر همه شهر شور و غوغاست
باری، به نظاره‌ای برون آی
کان روی تو از در تماشاست
پنهان چه شوی؟ که عکس رویت
در جام جهان نمای پیداست
گل گر ز رخ تو رنگ ناورد
رنگ رخش آخر از چه زیباست؟
ور نه به جمال تو نظر کرد
چشم خوش نرگس از چه بیناست؟
ور سرو نه قامت تو دیده است
او را کشش از چه سوی بالاست
تا یافت بنفشه بوی زلفت
ما را همه میل سوی صحراست
ما را چه ز باغ لاله و گل؟
از جام، غرض می مصفاست
جز حسن و جمال تو نبیند
از گلشن و لاله هر که بیناست
باز مرا در غمت واقعه جانی است
در دل زارم نگر، تا به چه حیرانی است
دل که ز جان سیر گشت خون جگر می‌خورد
بر سر خوان غمت باز به مهمانی است
چون دل تنگم نشد شاد به تو یک زمان
باز گذارش به غم، کو به غم ارزانی است
تا سر زلفین تو کرد پریشان دلم
هیچ نگویی بدو کین چه پریشانی است؟
از دل من خون چکید بر جگرم نم نماند
تا ز غمت دیده‌ام در گهر افشانی است
آه! که در طالعم باز پراکندگی است
بخت بد آخر بگو کین چه پریشانی است
رفت که بودی مرا کار به سامان، دریغ!
نوبت کارم کنون بی سر و سامانی است
صبح وصالم بماند در پس کوه فراق
روز امیدم چو شب تیره و ظلمانی است
وصل چو تو پادشه کی به گدایی رسد؟
جستن وصلت مرا مایهٔ نادانی است
خیز، دلا، وصل جو، ترک عراقی بگو
دوست مدارش، که او دشمن پنهانی است"
eraghi,divane,"
ز خواب، نرگس مست تو سر گران برخاست
خروش و ولوله از جان عاشقان برخاست
چه سحر کرد ندانم دو چشم جادوی تو؟
که از نظارگیان ناله و فغان برخاست
به تیر غمزه، ازین بیش، خون خلق مریز
که رستخیز به یکباره از جهان برخاست
بدین صفت که تو آغاز کرده‌ای خونریز
چه سیل خواهد ازین تیره خاکدان برخاست!
بیا و آب رخ از تشنگان دریغ مدار
طریق مردمی آخر نه از جهان برخاست؟
چنین که من ز فراق تو بر سر آمده‌ام
گرم تو دست نگیری کجا توان برخاست؟
تو در کنار من آ، تا من از میان بروم
که هر کجا که برآید یقین گمان برخاست
به بوی آنکه به دامان تو درآویزد
دل من از سر جان آستین‌فشان برخاست
عراقی از دل و جان آن زمان امید برید
که چشم مست تو از خواب سرگران برخاست
ناگه از میکده فغان برخاست
ناله از جان عاشقان برخاست
شر و شوری فتاد در عالم
های و هویی از این و آن برخاست
جامی از میکده روان کردند
در پیش صد روان، روان برخاست
جرعه‌ای ریختند بر سر خاک
شور و غوغا ز جرعه‌دان برخاست
جرعه با خاک در حدیث آمد
گفت و گویی از این میان برخاست
سخن جرعه عاشقی بشنید
نعره زد و ز سر جهان برخاست
بخت من، چون شنید آن نعره
سبک از خواب، سر گران برخاست
گشت بیدار چشم دل، چو مرا
عالم از پیش جسم و جان برخاست
خواستم تا ز خواب برخیزم
بنگرم کز چه این فغان برخاست؟
بود بر پای من، عراقی، بند
بند بر پای چون توان برخاست؟
مهر مهر دلبری بر جان ماست
جان ما در حضرت جانان ماست
پیش او از درد می‌نالم ولیک
درد آن دلدار ما درمان ماست
بس عجب نبود که سودایی شوم
کیت سودای او در شان ماست
جان ما چوگان و دل سودایی است
گوی زلفش در خم چوگان ماست
اسب همت را چو در زین آوریم
هر دو عالم گوشهٔ میدان ماست
با وجود این چنین زار و نزار
بر بساط معرفت جولان ماست
وزن می‌ننهندمان خلقان ولیک
کس چه داند آنچه در خلقان ماست؟
گر ز ما برهان طلب دارد کسی
نور او در جان ما برهان ماست
جنت پر انگبین و شیر و می
بی‌جمال دوست شورستان ماست
گرچه در صورت گدایی می‌کنیم
گنج معنی در دل ویران ماست
هاتف دولت مرا آواز داد:
کین نوامی گو: عراقی، ز آن ماست
چنین که حال من زار در خرابات است
می مغانه مرا بهتر از مناجات است
مرا چو می‌نرهاند ز دست خویشتنم
به میکده شدنم بهترین طاعات است
درون کعبه عبادت چه سود؟ چون دل من
میان میکده مولای عزی و لات است
مرا که بتکده و مصطبه مقام بود
چه جای صومعه و زهد و وجد و حالات است؟
مرا که قبله خم ابروی بتان باشد
چه جای مسجد و محراب و زهد و طاعات است
ملامتم مکنید، ار به دیر درد کشم
که حال بی‌خبران بهترین حالات است
ز ذوق با خبری آنکه را خبر باشد
به نزد او سخن ناقصان خرافات است
خراب کوی خرابات را از آن چه خبر
که اهل صومعه را بهترین مقامات است
اگر چه اهل خرابات را ز من ننگی است
مرا نصیحت ایشان بسی مباهات است
کسی که حالت دیوانگان میکده یافت
مقام اهل خرد نزدش از خرافات است
گلیم بخت کسی را که بافتند سیاه
سفید کردن آن نوعی از محالات است
کجاست می؟ که به جان آمدم ز خسته دلی
که پر ز شیوه و سالوس و زرق و طامات است
مقام دردکشانی که در خراباتند
یقین بدان که ورای همه مقامات است
کنون مقام عراقی مجوی در مسجد
که او حریف بتان است و در خرابات است
ندیده‌ام رخ خوب تو، روزکی چند است
بیا، که دیده به دیدارت آرزومند است
به یک نظاره به روی تو دیده خشنود است
به یک کرشمه دل از غمزهٔ تو خرسند است
فتور غمزهٔ تو خون من بخواهد ریخت
بدین صفت که در ابرو گره درافکند است
یکی گره بگشای از دو زلف و رخ بنمای
که صدهزار چو من دلشده در آن بند است
مبر ز من، که رگ جان من بریده شود
بیا، که با تو مرا صدهزار پیوند است
مرا چو از لب شیرین تو نصیبی نیست
از آن چه سود که لعل تو سر به سرقند است؟
کسی که همچو عراقی اسیر عشق تو نیست
شب فراق چه داند که تا سحر چند است؟"
