author,book,text
eraghi,divane,"
عشق شوقی در نهاد ما نهاد
جان ما را در کف غوغا نهاد
فتنه‌ای انگیخت، شوری درفکند
در سرا و شهر ما چون پا نهاد
جای خالی یافت از غوغا و شور
شور و غوغا کرد و رخت آنجا نهاد
نام و ننگ ما همه بر باد داد
نام ما دیوانه و رسوا نهاد
چون عراقی را، درین ره، خام یافت
جان ما بر آتش سودا نهاد
بر من، ای دل، بند جان نتوان نهاد
شور در دیوانگان نتوان نهاد
های و هویی در فلک نتوان فکند
شر و شوری در جهان نتوان نهاد
چون پریشانی سر زلفت کند
سلسله بر پای جان نتوان نهاد
چون خرابی چشم مستت می‌کند
جرم بر دور زمان نتوان نهاد
عشق تو مهمان و ما را هیچ نه
هیچ پیش میهمان نتوان نهاد
نیم جانی پیش او نتوان کشید
پیش سیمرغ استخوان نتوان نهاد
گرچه گه‌گه وعدهٔ وصلم دهد
غمزهٔ تو، دل بر آن نتوان نهاد
گویمت: بوسی به جانی، گوییم:
بر لبم لب رایگان نتوان نهاد
بر سر خوان لبت، خود بی‌جگر
لقمه‌ای خوش در دهان نتوان نهاد
بر دلم بار غمت چندین منه
برکهی کوه گران نتوان نهاد
شب در دل می‌زدم، مهر تو گفت:
زود پابر آسمان نتوان نهاد
تا تو را در دل هوای جان بود
پای بر آب روان نتوان نهاد
تات وجهی روشن است، این هفت‌خوان
پیش تو بس، هشت خوان نتوان نهاد
ور عراقی محرم این حرف نیست
راز با او در میان نتوان نهاد
بی‌رخت جان در میان نتوان نهاد
بی‌یقین پا بر گمان نتوان نهاد
جان بباید داد و بستد بوسه‌ای
بی‌کنارت در میان نتوان نهاد
نیم‌جانی دارم از تو یادگار
بر لبت لب رایگان نتوان نهاد
در جهان چشمت خرابی می‌کند
جرم بر دور زمان نتوان نهاد
خون ما ز ابرو و مژگان ریختی
تیر به زین در کمان نتوان نهاد
حال من زلفت پریشان می‌کند
پس گنه بر دیگران نتوان نهاد
در جهان چون هرچه خواهی می‌کنی
جرم بر هر ناتوان نتوان نهاد
هر چه هست اندر همه عالم تویی
نام هستی بر جهان نتوان نهاد
چون تو را، جز تو، نمی‌بیند کسی
منتی بر عاشقان نتوان نهاد
بر در وصلت چو کس می‌گذرد
تهمتی بر انس و جان نتوان نهاد
عاشق تو هم تو بس، پس نام عشق
گه برین و گه بر آن نتوان نهاد
تا نگیرد دست من دامان تو
پای دل بر فرق جان نتوان نهاد
چون عراقی آستین ما گرفت
رخت او بر آسمان نتوان نهاد
هر شب دل پر خونم بر خاک درت افتد
باشد که چو روز آید بروی گذرت افتد
زیبد که ز درگاهت نومید نگردد باز
آن کس که به امیدی بر خاک درت افتد
آیم به درت افتم، تا جور کنی کمتر
از بخت بدم گویی خود بیشترت افتد
من خاک شوم، جانا، در رهگذرت افتم
آخر به غلط روزی بر من گذرت افتد
گفتم که: بده دادم، بیداد فزون کردی
بد رفت، ندانستم، گفتم: مگرت افتد
در عمر اگر یک دم خواهی که دهی دادم
ناگاه چو وابینی رایی دگرت افتد
کم نال، عراقی، زانک این قصهٔ درد تو
گر شرح دهی عمری، هم مختصرت افتد
بنمای به من رویت، یارات نمی‌افتد
آری چه توان کردن؟ با مات نمی‌افتد
گیرم که نمی‌افتد با وصل منت رایی
با جور و جفا، باری، هم‌رات نمی‌افتد؟
می‌افتدت این یک دم کیی براین پر غم
شادم کنی و خرم، هان یات نمی‌افتد؟
هر بیدل و شیدایی افتاده به سودایی
وندر دل من الا سودات نمی‌افتد
با عشق تو می‌بازم شطرنج وفا، لیکن
از بخت بدم، باری، جز مات نمی‌افتد
از غمزهٔ خونریزت هرجای شبیخون است
شب نیست که این بازی صد جات نمی‌افتد
افتاده دو صد شیون از جور تو هرجایی
این جور و جفا با من تنهات نمی‌افتد
بیچاره عراقی، هان! دم درکش و خون می‌خور
چون هیچ دمی با او گیرات نمی‌افتد
با شمع روی خوبان پروانه‌ای چه سنجد؟
با تاب موی جانان دیوانه‌ای چه سنجد؟
در کوی عشقبازان صد جای جوی نیرزد
تن خود چه قیمت آرد؟ویرانه‌ای چه سنجد؟
با عاشقان شیدا، سلطان کجا برآید؟
در پیش آشنایان بیگانه‌ای چه سنجد؟
در رزم پاکبازان عالم چه قدر دارد؟
در بزم بحر نوشان پیمانه‌ای چه سنجد؟
از صدهزار خرمن یک دانه است عالم
با صدهزار عالم پس دانه‌ای چه سنجد؟
چون عشق در دل آمد، آنجا خرد نیامد
چون شاه رخ نماید فرزانه‌ای چه سنجد؟
گرچه عراقی، از عشق، فرزانهٔ جهان شد
آنجا که این حدیث است افسانه‌ای چه سنجد؟"
eraghi,divane,"
با عشق عقل‌فرسا دیوانه‌ای چه سنجد؟
با شمع روی زیبا پروانه‌ای چه سنجد؟
پیش خیال رویت جانی چه قدر دارد؟
با تاب بند مویت دیوانه‌ای چه سنجد؟
با وصل جان‌فزایت جان را چه آشنایی؟
در کوی آشنایی بیگانه‌ای چه سنجد؟
چون زلف برفشانی عالم خراب گردد
دل خود چه طاقت آرد؟ویرانه‌ای چه سنجد؟
گرچه خوش است و دلکش کاشانه‌ای است جنت
در جنت حسن رویت کاشانه‌ای چه سنجد؟
با من اگر نشینی برخیزم از سر جان
پیش بهشت رویت غم خانه‌ای چه سنجد
گیرم که خود عراقی، شکرانه، جان فشاند
در پیش آن چنان رو، شکرانه‌ای چه سنجد؟
با عشق قرار در نگنجد
جز نالهٔ زار در نگنجد
با درد تو دردسر نباشد
با باده خمار در نگنجد
من با تو سزد که در نگنجم
با دیده غبار در نگنجد
در دل نکنی مقام یعنی
با قلب عیار در نگنجد
در دیده خیال تو نیاید
با آب نگار در نگنجد
بوسی ندهی به طنز و گویی:
با بوسه کنار در نگنجد
با چشم تو شاید ار ببینم
با جام خمار در نگنجد
آنجا که منم تو هم نگنجی
با لیل نهار در نگنجد
شد عار همه جهان عراقی
با فخر تو عار در نگنجد
با عشق تو ناز در نگنجد
جز درد و نیاز در نگنجد
با درد تو درد در نیاید
با سوز تو ساز در نگنجد
بیچاره کسی که از در تو
دور افتد و باز در نگنجد
با داغ غمت درون سینه
جز سوز و گداز در نگنجد
با عشق حقیقیت به هر حال
سودای مجاز در نگنجد
در میکده با حریف قلاش
تسبیح و نماز در نگنجد
در جلوه‌گه جمال حسنت
خوبی ایاز در نگنجد
با یاد لب تو در خیالم
اندیشهٔ گاز در نگنجد
آنجا که رود حدیث وصلت
یک محرم راز در نگنجد
وآندم که حدیث زلفت افتد
جز شرح دراز در نگنجد
چه ناز کنی عراقی اینجا؟
جان باز، که ناز در نگنجد
جانا، حدیث شوقت در داستان نگنجد
رمزی ز راز عشقت در صد بیان نگنجد
جولانگه جلالت در کوی دل نباشد
خلوتگه جمالت در جسم و جان نگنجد
سودای زلف و خالت جز در خیال ناید
اندیشهٔ وصالت جز در گمان نگنجد
در دل چو عشقت آید، سودای جان نماند
در جان چو مهرت افتد، عشق روان نگنجد
دل کز تو بوی یابد، در گلستان نپوید
جان کز تو رنگ بیند، اندر جهان نگنجد
پیغام خستگانت در کوی تو که آرد؟
کانجا ز عاشقانت باد وزان نگنجد
آن دم که عاشقان را نزد تو بار باشد
مسکین کسی که آنجا در آستان نگنجد
بخشای بر غریبی کز عشق تو بمیرد
وآنگه در آستانت خود یک زمان نگنجد
جان داد دل که روزی کوی تو جای یابد
نشناخت او که آخر جایی چنان نگنجد
آن دم که با خیالت دل راز عشق گوید
گر جان شود عراقی، اندر میان نگنجد
امروز مرا در دل جز یار نمی‌گنجد
وز یار چنان پر شد کاغیار نمی‌گنجد
در چشم پر آب من جز دوست نمی‌آید
در جان خراب من جز یار نمی‌گنجد
این لحظه از آن شادم کاندر دل تنگ من
غم جای نمی‌گیرد، تیمار نمی‌گنجد
این قطرهٔ خون تا یافت از لعل لبش رنگی
از شادی آن در پوست چون نار نمی‌گنجد
رو بر در او سرمست، از عشق رخش، زیراک:
در بزم وصال او هشیار نمی‌گنجد
شیدای جمال او در خلد نیارامد
مشتاق لقای او در نار نمی‌گنجد
چون پرده براندازد عالم بسر اندازد
جایی که یقین آید پندار نمی‌گنجد
از گفت بد دشمن آزرده نگردم زانک:
با دوست مرا در دل آزار نمی‌گنجد
جانم در دل می‌زد، گفتا که: برو این دم
با یار درین جلوه دیار نمی‌گنجد
خواهی که درون آیی بگذار عراقی را
کاندر طبق انوار اطوار نمی‌گنجد
امروز مرا در دل جز یار نمی‌گنجد
تنگ است، از آن در وی اغیار نمی‌گنجد
در دیدهٔ پر آبم جز یار نمی‌آید
وندر دلم از مستی جز یار نمی‌گنجد
با این همه هم شادم کاندر دل تنگ من
غم چاره نمی‌یابد، تیمار نمی‌گنجد
جان در تنم ار بی‌دوست هربار نمی‌گنجد
از غایت تنگ آمد کین بار نمی‌گنجد
کو جام می عشقش؟ تا مست شوم زیراک:
در بزم وصال او هشیار نمی‌گنجد
کو دام سر زلفش؟ تا صید کند دل را
کاندر خم زلف او دلدار نمی‌گنجد
چون طره برافشاند این روی بپوشاند
جایی که یقین آید پندار نمی‌گنجد
عشقش چو درون تازد جان حجره بپردازد
آنجا که وطن سازد دیار نمی‌گنجد
این قطرهٔ خون تا یافت از خاک درش بویی
از شادی آن در پوست چون نار نمی‌گنجد
غم گرچه خورد جانم، هم غم نخورم زیراک:
اندر حرم جانان غمخوار نمی‌گنجد
تحفه بر دل بردم جان و تن و دین و هوش
دل گفت: برو، کانجا هر چار نمی‌گنجد
خواهی که درآیی تو، بگذار عراقی را
کاندر حرم جانان جز یار نمی‌گنجد"
eraghi,divane,"
در حلقهٔ فقیران قیصر چه کار دارد؟
در دست بحر نوشان ساغر چه کار دارد؟
در راه عشقبازان زین حرف‌ها چه خیزد؟
در مجلس خموشان منبر چه کار دارد؟
جایی که عاشقان را درس حیات باشد
ایبک چه وزن آرد؟ سنجر چه کار دارد؟
جایی که این عزیزان جام شراب نوشند
آب زلال چبود؟ کوثر چه کار دارد؟
وآنجا که بحر معنی موج بقا برآرد
بر کشتی دلیران لنگر چه کار دارد؟
در راه پاکبازان این حرف‌ها چه خیزد؟
بر فرق سرفرازان افسر چه کار دارد؟
آن دم که آن دم آمد، دم در نگنجد آنجا
جایی که ره برآید، رهبر چه کار دارد؟
دایم، تو ای عراقی، می‌گوی این حکایت:
با بوی مشک معنی، عنبر چه کار دارد؟
با پرتو جمالت برهان چه کار دارد؟
با عشق زلف و خالت ایمان چه کار دارد؟
با عشق دلگشایت عاشق کجا برآید؟
با وصل جانفزایت هجران چه کار دارد؟
در بارگاه دردت درمان چه راه یابد؟
با جلوه‌گاه وصلت هجران چه کار دارد؟
با سوز بی‌دلانت مالک چه طاقت آرد؟
با عیش عاشقانت رضوان چه کار دارد؟
گرنه گریخت جانم از پرتو جمالت
در سایهٔ دو زلفت پنهان چه کار دارد؟
چون در پناه وصلت افتاد جان نگویی:
هجری بدین درازی با جان چه کار دارد؟
گر در خورت نیابم، شاید، که بر سماطت
پوسیده استخوانی بر خوان چه کار دارد؟
آری عجب نباشد گر در دلم نیابی
در کلبهٔ گدایان سلطان چه کار دارد؟
من نیز اگر نگنجم در حضرتت، عجب نیست
آنجا که آن کمال است نقصان چه کار دارد؟
در تنگنای وحدت کثرت چگونه گنجد
در عالم حقیقت بطلان چه کار دارد؟
گویند نیکوان را نظارگی نباید
کانجا که درد نبود درمان چه کار دارد؟
آری، ولی چو عاشق پوشید رنگ معشوق
آن دم میان ایشان دربان چه کار دارد؟
جایی که در میانه معشوق هم نگنجد
مالک چه زحمت آرد؟ رضوان چه کار دارد ؟
هان! خسته دل عراقی، با درد یار خو کن
کانجا که دردش آمد درمان چه کار دارد؟
با درد خستگانت درمان چه کار دارد؟
با وصل کشتگانت هجران چه کار دارد؟
از سوز بی‌دلانت مالک خبر ندارد
با عیش عاشقانت رضوان چه کار دارد؟
در لعل توست پنهان صدگونه آب حیوان
از بی‌دلی لب من با آن چه کار دارد؟
هم دیدهٔ تو باید تا چهرهٔ تو بیند
کانجا که آن جمال است انسان چه کار دارد؟
وهم از دهان تنگت هرگز نشان نیاید
با خاتم سلیمان شیطان چه کار دارد؟
جان من از لب تو مانا که یافت ذوقی
ورنه خیال جاوید با جان چه کار دارد؟
دل می‌تپد که بیند در دیده روی خوبت
ورنه برید زلفت پنهان چه کار دارد؟
عاشق گر از در تو نشنید مرحبایی
چون حلقه بر در تو چندان چه کار دارد؟
گر بر درت نیایم، شاید که باز پرسند:
پوسیده استخوانی با خوان چه کار دارد؟
در دل که عشق نبود معشوق کی توان یافت
جایی که جان نباشد جانان چه کار دارد؟
در دل غم عراقی و آنگاه عشق باقی
در خانهٔ طفیلی مهمان چه کار دارد؟
با درد خستگانت درمان چه کار دارد؟
با وصل کشتگانت هجران چه کار دارد؟
با محنت فراقت راحت چه رخ نماید؟
با درد اشتیاقت درمان چه کار دارد؟
گر در دلم خیالت ناید عجب نباشد
در دوزخ پر آتش رضوان چه کار دارد؟
سودای تو نگنجد اندر دلی که جان است
در خانهٔ طفیلی مهمان چه کار دارد؟
دل را خوش است با جان گر زآن توست، یارا
بی‌روی تو دل من با جان چه کار دارد؟
بر بوی وصلت، ای جان، دل بر در تو مانده است
ور نه فتاده در خاک چندان چه کار دارد؟
با عشق توست جان را صد سر سر نهفته
لیکن دل عراقی با جان چه کار دارد؟
خرم تن آن کس که دل ریش ندارد
و اندیشهٔ یار ستم‌اندیش ندارد
گویند رقیبان که ندارد سر تو یار
سلطان چه عجب گر سر درویش ندارد؟
او را چه خبر از من و از حال دل من
کو دیدهٔ پر خون و دل ریش ندارد
این طرفه که او من شد و من او و ز من یار
بیگانه چنان شد که سر خویش ندارد
هان، ای دل خونخوار، سر محنت خود گیر
کان یار سر صحبت ما بیش ندارد
معشوق چو شمشیر جفا برکشد، از خشم
عاشق چه کند گر سر خود پیش ندارد؟
بیچاره دل ریش عراقی که همیشه
از نوش لبان، بهره به جز نیش ندارد"
eraghi,divane,"
بیا، کاین دل سر هجران ندارد
بجز وصلت دگر درمان ندارد
به وصل خود دلم را شاد گردان
که خسته طاقت هجران ندارد
بیا، تا پیش روی تو بمیرم
که بی‌تو زندگانی آن ندارد
چگونه بی‌تو بتوان زیست آخر؟
که بی‌تو زیستن امکان ندارد
بمردم ز انتظار روز وصلت
شب هجران مگر پایان ندارد؟
بیا، تا روی خوب تو ببینم
که مهر از ذره رخ پنهان ندارد
ز من بپذیر، جانا، نیم جانی
اگر چه قیمت چندان ندارد
چه باشد گر فراغت واله ای را
چنین سرگشته و حیران ندارد؟
وصالت تا ز غم خونم نریزد
عراقی را شبی مهمان ندارد
دل، دولت خرمی ندارد
جان، راحت بی‌غمی ندارد
دردا! که درون آدمی زاد
آسایش و خرمی ندارد
از راحت‌های این جهانی
جز غم دل آدمی ندارد
ای مرگ، بیا و مردمی کن
این غم سر مردمی ندارد
وی غم، بنشین، که شادمانی
با ما سر همدمی ندارد
وی جان، ز سرای تن برون شو
کین جای تو محکمی ندارد
منشین همه وقت با عراقی
کاهلیت محرمی ندارد
راحت سر مردمی ندارد
دولت دل همدمی ندارد
ز احسان زمانه دیده بردوز
کو دیدهٔ مردمی ندارد
از خوان فلک نواله کم پیچ
کو گردهٔ گندمی ندارد
با درد بساز، از آنکه درمان
با جان تو محرمی ندارد
در تار حیات دل چه بندی؟
چون پود تو محکمی ندارد
دردا! که درین سرای پر غم
کس دولت بی‌غمی ندارد
دارد همه چیز آدمی زاد
افسوس که خرمی ندارد
گر خوشدلیی درین جهان هست
باری دل آدمی ندارد
بنمای به من دلی فراهم
کو محنت درهمی ندارد
کم خور غم این جهان، عراقی،
زیرا که غمش کمی ندارد
نگارا، بی‌تو برگ جان که دارد؟
دل شاد و لب خندان که دارد؟
به امید وصالت می‌دهم جان
وگرنه طاقت هجران که دارد؟
غم ار ندهد جگر بر خوان وصلت
دل درویش را مهمان که دارد؟
نیاید جز خیالت در دل من
بجز یوسف سر زندان که دارد؟
مرا با تو خوش آید خلد، ورنه
غم حور و سر رضوان که دارد؟
همه کس می کند دعوی عشقت
ولی با درد بی درمان که دارد ؟
غمت هر لحظه جانی خواهد از من
چه انصاف است؟ چندین جان که دارد؟
مرا گویند: فردا روز وصل است
وگرنه طاقت هجران که دارد؟
نشان عشق می‌جویی، عراقی
ببین تا چشم خون افشان که دارد؟
نگارا، بی تو برگ جان که دارد؟
سر کفر و غم ایمان که دارد؟
اگر عشق تو خون من نریزد
غمت را هر شبی مهمان که دارد؟
دل من با خیالت دوش می‌گفت:
که این درد مرا درمان که دارد؟
لب شیرین تو گفتا: ز من پرس
که من با تو بگویم: کان که دارد؟
مرا گفتی که: فردا روز وصل است
امید زیستن چندان که دارد؟
دلم در بند زلف توست ور نه
سر سودای بی‌پایان که دارد؟
اگر لطف خیال تو نباشد
عراقی را چنین حیران که دارد؟
تا کی کشم جفای تو؟ این نیز بگذرد
بسیار شد بلای تو، این نیز بگذرد
عمرم گذشت و یک نفسم بیشتر نماند
خوش باش کز جفای تو، این نیز بگذرد
آیی و بگذری به من و باز ننگری
ای جان من فدای تو، این نیز بگذرد
هر کس رسید از تو به مقصود و این گدا
محروم از عطای تو، این نیز بگذرد
ای دوست، تو مرا همه دشنام می‌دهی
من می‌کنم، دعای تو، این نیز بگذرد
آیم به درگهت، نگذاری که بگذرم
پیرامن سرای تو، این نیز بگذرد
آمد دلم به کوی تو، نومید بازگشت
نشنید مرحبای تو، این نیز بگذرد
بگذشت آنکه دوست همی داشتی مرا
دیگر شده است رای تو، این نیز بگذرد
تا کی کشد عراقی مسکین جفای تو؟
بگذشت چون جفای تو، این نیز بگذرد
بیا بیا، که نسیم بهار می‌گذرد
بیا، که گل ز رخت شرمسار می‌گذرد
بیا، که وقت بهار است و موسم شادی
مدار منتظرم، وقت کار می‌گذرد
ز راه لطف به صحرا خرام یک نفسی
که عیش تازه کنم، چون بهار می‌گذرد
نسیم لطف تو از کوی می‌برد هر دم
غمی که بر دل این جان فگار می‌گذرد
ز جام وصل تو ناخورده جرعه‌ای دل من
ز بزم عیش تو در سر خمار می‌گذرد
سحرگهی که به کوی دلم گذر کردی
به دیده گفت دلم: کان شکار می‌گذرد
چو دیده کرد نظر صدهزار عاشق دید
که نعره می‌زد هر یک که: یار می‌گذرد
به گوش جان عراقی رسید آن زاری
از آن ز کوی تو زار و نزار می‌گذرد"
