author,book,text
eraghi,divane,"
آن را که غمت ز در براند
بختش همه دربدر دواند
وآن را که عنایت تو ره داد
جز بر در تو رهی نداند
وآن را که قبول عشقت افتاد
جان را بدهد، غمت ستاند
عاشق که گذر کند به کویت
جان پیش سگ درت فشاند
با وصل بگو که: عاشقان را
از دست فراق وارهاند
بیچاره دلم که کشتهٔ توست
دور از رخ تو نمی‌تواند
بویی به نسیم کوی خود ده
تا صبحدمی به دل رساند
کین مرده به بوت زنده گردد
وز عشق رخت کفن دراند
مگذار که خسته دل عراقی
بی‌عشق تو عمر بگذراند
این درد مرا دوا که داند؟
وین نامهٔ اندهم که خواند؟
جز لطف توام که دست گیرد؟
جز رحمت تو که‌ام رهاند؟
بنمای رخت به دردمندی
تا بر سر کوت جان فشاند
آیا بود آنکه بی‌دلی را
لطف تو به کام دل رساند؟
افتادم بر در قبولت
امید که از درم نراند
کار دل من عنایت تو
گر بهتر ازین کند، تواند
مهری ز قبول بر دلم نه
کین قلب کسی نمی‌ستاند
چون حلقه برین دری، عراقی
می‌باش و مگرد، بو که داند
در من نگرد یار دگربار؟ که داند؟
زین پس دهدم بر در خود بار؟ که داند؟
از یاد خودم کرد فراموش به یکبار
یادآورد از من دگر آن یار؟ که داند؟
خون شد جگرم از غم و اندیشهٔ آن دوست
خشنود شود از من غمخوار؟ که داند؟
بیمار دلم، خسته جگر از غم عشقش
آید به عیادت بر بیمار؟ که داند؟
ای دشمن بدخواه، چه باشی به غمم شاد؟
باشد که شود دوست دگربار؟ که داند؟
در بند امید، ای دل، بگشای دو دیده
باشد که ببینی رخ دلدار! که داند؟
روشن شود این تیره شب بخت عراقی
از صبح رخ یار وفادار، که داند؟
ای دل، چو در خانهٔ خمار گشادند
می‌نوش، که از می گره کار گشادند
در خود منگر، نرگس مخمور بتان بین
در کعبه مرو، چون در خمار گشادند
از خود بدرآ، در رخ خوبان نظری کن
در خان منشین چون در گلزار گشادند
بنگر که: دو صد مهر به یک ذره نمودند
از یک سر مویی که ز رخسار گشادند
تا باز گشادند سر زلف ز رخسار
از روی جهان زلف شب تار گشادند
تا مهر گیاهی ز گل تیره برآید
بر روی زمین چشمهٔ انوار گشادند
تا لاله رخی در چمن آید به تماشا
از چهرهٔ گل پردهٔ زنگار گشادند
از پرتو مل پردهٔ خورشید دریدند
وز خندهٔ گل مبسم اشجار گشادند
تا کرد نسیم سحر آفاق معطر
در هر چمنی طبلهٔ عطار گشادند
مانا که صبا کرد پریشان سر زلفین
کز بوی خوشش نافهٔ تاتار گشادند
در گوش دلم گفت صبا دوش: عراقی
در بند در خود، که در یار گشادند
چشم سر اغیار ببستند ز غیرت
آنگاه در مخزن اسرار گشادند
نخستین باده کاندر جام کردند
ز چشم مست ساقی وام کردند
چو باخود یافتند اهل طرب را
شراب بیخودی در جام کردند
لب میگون جانان جام در داد
شراب عاشقانش نام کردند
ز بهر صید دل‌های جهانی
کمند زلف خوبان دام کردند
به گیتی هر کجا درد دلی بود
به هم کردند و عشقش نام کردند
سر زلف بتان آرام نگرفت
ز بس دل‌ها که بی‌آرام کردند
چو گوی حسن در میدان فکندند
به یک جولان دو عالم رام کردند
ز بهر نقل مستان از لب و چشم
مهیا پسته و بادام کردند
از آن لب، کز در صد آفرین است
نصیب بی‌دلان دشنام کردند
به مجلس نیک و بد را جای دادند
به جامی کار خاص و عام کردند
به غمزه صد سخن با جان بگفتند
به دل ز ابرو دو صد پیغام کردند
جمال خویشتن را جلوه دادند
به یک جلوه دو عالم رام کردند
دلی را تا به دست آرند، هر دم
سر زلفین خود را دام کردند
نهان با محرمی رازی بگفتند
جهانی را از آن اعلام کردند
چو خود کردند راز خویشتن فاش
عراقی را چرا بدنام کردند؟
نگارا، جسمت از جان آفریدند
ز کفر زلفت ایمان آفریدند
جمال یوسف مصری شنیدی؟
تو را خوبی دو چندان آفریدند
ز باغ عارضت یک گل بچیدند
بهشت جاودان زان آفریدند
غباری از سر کوی تو برخاست
وزان خاک آب حیوان آفریدند
غمت خون دل صاحبدلان ریخت
وزان خون لعل و مرجان آفریدند
سراپایم فدایت باد و جان هم
که سر تا پایت را جان آفریدند
ندانم با تو یک دم چون توان بود؟
که صد دیوت نگهبان آفریدند
دمادم چند نوشم درد دردت؟
مرا خود مست و حیران آفریدند
ز عشق تو عراقی را دمی هست
کزان دم روی انسان آفریدند"
eraghi,divane,"
اگر شکسته دلانت هزار جان دارند
به خدمت تو کمر بسته بر میان دارند
شدند حلقه به گوش تو را چو حلقه به گوش
چه خوش دلند که مثل تو دلستان دارند
کسان که وصل تو یک دم به نقد یافته‌اند
از ین طلب طرب و عیش جاودان دارند
چو بگذری به تعجب تو ماهروی به راه
چو ماه ماهرخان دست بر دهان دارند
خرد از آن ز ره زلف تو پناه گرفت
که چشم و ابروی تو تیر در کمان دارند
مجاهدان رهت تا عنایت تو بود
چه بیم و باک به عالم ازین و آن دارند؟
ز آب دیده و تاب دل است غمازی
وگرنه راز تو بیچارگان نهان دارند
غلام غمزهٔ بیمارتم که از هوسش
چه تندرستان خود را ناتوان دارند؟
اگر کسی به شکایت بود ز دلبر خویش
ز تو عراقی و دل شکر بی‌کران دارند
چو چشم مست تو آغاز کبر و ناز کند
بسا که بر دلم از غمزه ترکتاز کند
مرا مکش، که نیاز منت بکار آید
چو من نمانم حسن تو با که ناز کند؟
مرا به دست سر زلف خویش باز مده
اگر چه همچو خودم زود سرفراز کند
منم چو مردم چشمت، به من نگاهی کن
که اهل دیده به مردم نگاه باز کند
چگونه دوست ندارد ایاز را محمود؟
که او نگاه به چشم خوش ایاز کند
ز جور تو بگریزم، برم به عشق پناه
که از غم تو مرا عشق بی‌نیاز کند
نیاز و ناز من و تو فرود برد به دمی
نهنگ عشق حقیقت دهن چو باز کند
ازین حدیث، اگرچه ز پرده بیرون است
زمانه پردهٔ عشاق بس که ساز کند
به آب دیده عراقی وضو همی سازد
چو قامت تو بدید آنگهی نماز کند
باز دلم عیش و طرب می‌کند
هیچ ندانم چه سبب می‌کند؟
از می عشق تو مگر مست شد
کین همه شادی و طرب می‌کند؟
تا سر زلف تو پریشان بدید
شیفته شد ، شور و شغب می کند
تا دل من در سر زلف تو شد
عیش همه در دل شب می‌کند
برد به بازی دل جمله جهان
زلف تو بازی چه عجب می‌کند؟
طرهٔ طرار تو کرد آن چه کرد
فتنه نگر باز که لب می‌کند
می‌برد از من دل و گوید به طنز:
باز فلانی چه طلب می‌کند؟
از لب لعلش چه عجب گر مرا
آرزوی قند و طرب می‌کند
گر طلبد بوسه، عراقی مرنج،
گرچه همه ترک ادب می‌کند
هر که او دعوی مستی می‌کند
آشکارا بت‌پرستی می‌کند
هستی آن را می‌سزد کز نیستی
هر نفس صدگونه هستی می‌کند
هر که از خاک درش رفعت نیافت
لاجرم سر سوی پستی می‌کند
دل که خورد از جام عشقش جرعه‌ای
بی‌خبر شد، شور و مستی می‌کند
دل چو خواهم باختن در پای او
جان ز شوقش پیش دستی می‌کند
چند گویی کو جفا تا کی کند؟
ای عراقی، تا تو هستی می‌کند
به خرابات شدم دوش مرا بار نبود
می‌زدم نعره و فریاد ز من کس نشنود
یا نبد هیچ کس از باده‌فروشان بیدار
یا خود از هیچ کسی هیچ کسم در نگشود
چون که یک نیم ز شب یا کم یا بیش برفت
رندی از غرفه برون کرد سر و رخ بنمود
گفت: خیر است، درین وقت تو دیوانه شدی
نغز پرداختی آخر تو نگویی که چه بود؟
گفتمش: در بگشا، گفت: برو، هرزه مگوی
تا درین وقت ز بهر چو تویی در که گشود؟
این نه مسجد که به هر لحظه درش، بگشایند
تا تو اندر دوی، اندر صف پیش آیی زود
این خرابات مغان است و درو زنده‌دلان
شاهد و شمع و شراب و غزل و رود و سرود
زر و سر را نبود هیچ درین بقعه محل
سودشان جمله زیان است و زیانشان همه سود
سر کوشان عرفات است و سراشان کعبه
عاشقان همچو خلیلند و رقیبان نمرود
ای عراقی، چه زنی حلقه برین در شب و روز؟
زین همه آتش خود هیچ نبینی جز دود
هر که در بند زلف یار بود
در جهانش کجا قرار بود؟
وانکه چیند گلی ز باغ رخش
در دلش بس که خار خار بود
وانکه یاد لبش کند روزی
تا قیامت در آن خمار بود
کارهایی که چشم یار کند
نه زیاری روزگار بود
فتنه‌هایی که زلفش انگیزد
همه خود نقش آن نگار بود
از فلک آنکه هر شبی شنوی
نالهٔ بیدلان زار بود
نفس عاقشان او باشد
آن کزو چرخ را مدار بود
یک شبی با خیال او گفتم:
چند مسکین در انتظار بود؟
روی بنما، که جان نثار کنم
گفت: جان را چه اعتبار بود؟
تا تو در بند خویشتن مانی
کی تو را نزد دوست بار بود؟
نبود عاشق آنکه جوید کام
عشق را با غرض چه کار بود؟
عاشق آن است کو نخواهد هیچ
ور همه خود وصال یار بود
ای عراقی، تو اختیار مکن
کانکه به بود اختیار بود"
eraghi,divane,"
تا کی از ما یار ما پنهان بود؟
چشم ما تا کی چنین گریان بود؟
تا کی از وصلش نصیب بخت ما
محنت و درد دل و هجران بود؟
این چنین کز یار دور افتاده‌ام
گر بگرید دیده، جای آن بود
چون دل ما خون شد از هجران او
چشم ما شاید که خون افشان بود
از فراقش دل ز جان آمد به جان
خود گرانی یار مرگ جان بود
بر امیدی زنده‌ام، ورنه که را
طاقت آن هجر بی‌پایان بود؟
پیچ بر پیچ است بی او کار ما
کار ما تا کی چنین پیچان بود؟
محنت آباد دل پر درد ما
تا کی از هجران او ویران بود؟
درد ما را نیست درمان در جهان
درد ما را روی او درمان بود
چون دل ما از سر جان برنخاست
لاجرم پیوسته سرگردان بود
چون عراقی هر که دور از یار ماند
چشم او گریان، دلش بریان بود
ای خوشا دل کاندر او از عشق تو جانی بود
شادمان جانی که او را چون تو جانانی بود
خرم آن خانه که باشد چون تو مهمانی در او
مقبل آن کشور که او را چون تو سلطانی بود
زنده چون باشد دلی کز عشق تو بویی نیافت؟
کی بمیرد عاشقی کو را چو تو جانی بود؟
هر که رویت دید و دل را در سر زلفت نبست
در حقیقت آدمی نبود که حیوانی بود
در همه عمر ار برآرم بی غم تو یک نفس
زان نفس بر جان من هر لحظه تاوانی بود
آفتاب روی تو گر بر جهان تابد دمی
در جهان هر ذره‌ای خورشید تابانی بود
در همه عالم ندیدم جز جمال روی تو
گر کسی دعوی کند کو دید، بهتانی بود
گنج حسنی و نپندارم که گنجی در جهان
و آنچنان گنجی عجب در کنج ویرانی بود
آتش رخسار خوبت گر بسوزاند مرا
اندر آن آتش مرا هر سو گلستانی بود
روزی آخر از وصال تو به کام دل رسم
این شب هجر تو را گر هیچ پایانی بود
عاشقان را جز سر زلف تو دست‌آویز نیست
چه خلاص آن را که دست‌آویز ثعبانی بود؟
چون عراقی در غزل یاد لب تو می‌کند
هر نفس کز جان برآرد شکر افشانی بود
وه! که کارم ز دست می‌برود
روزگارم ز دست می‌برود
خود ندارم من از جهان چیزی
وآنچه دارم ز دست می‌برود
یک دمی دارم از جهان و آن نیز
چون برآرم ز دست می‌برود
بر زمانه چه دل نهم؟ که روان
همچو یارم ز دست می‌برود
در خزان ار دلی به دست آرم
در بهارم ز دست می‌برود
از پی صید دل چه دام نهم؟
که شکارم ز دست می‌برود
چه کنم پیش یار جان افشان؟
که نثارم ز دست می‌برود
نیست جز آب دیده در دستم
زان نگارم ز دست می‌برود
طالعم بین که: در چنین غم‌ها
غمگسارم ز دست می‌برود
بخت بنگر که: پای بر دم مار
یار غارم ز دست می‌برود
دستگیرا، نظر به کارم کن
بین که کارم ز دست می‌برود
اندرین ره هر که او یکتا شود
گنج معنی در دلش پیدا شود
جز جمال خود نبیند در جهان
اندرین ره هر که او بینا شود
قطره کز دریا برون آید همی
چون سوی دریا شود دریا شود
گر صفات خود کند یکباره محو
در مقامات بقا یکتا شود
هر که دل بر نیستی خود نهاد
در حریم هستی، او تنها شود
از مسما هر که یابد بهره‌ای
فارغ و آسوده از اسما شود
ور کند گم صورت هستی خویش
صورت او جملگی معنی شود
ور نهنگ لاخورش زو طعمه ساخت
زندهٔ جاوید در الا شود
صورتت چون شد حجاب راه تو
محو کن، تا سیرتت زیبا شود
گر از این منزل برون رفتی، یقین
دانکه منزلگاهت او ادنی شود
ما به جانان زنده‌ایم، از جان بری
تا ابد هرگز کسی چون ما شود؟
هر که آنجا مقصد و مقصود یافت
در دو عالم والی والا شود
هر که را دل رازدار عشق شد
کی دلش مایل سوی صحرا شود؟
هم به بالا در رسد بی‌عقل و دین
گر عراقی محو اندر لا شود
نگارینی که با ما می‌نپاید
به ما دلخستگان کی رخ نماید؟
بیا، ای بخت، تا بر خود بموییم
که از ما یار آرامی نماید
اگر جانم به لب آید عجب نیست
به حیله نیم جانی چند پاید؟
به نقد این لحظه جانی میکن ای دل
شب هجر است، تا فردا چه زاید؟
مگر روشن شود صبح امیدم
مگر خورشید از روزن برآید
دلم را از غم جان وا رهاند
مر از من زمانی در رباید
عراقی، بر درش امید در بند
که داند، بو که ناگه واگشاید"
eraghi,divane,"
مرا، گرچه ز غم جان می‌برآید
غم عشقت ز جانم خوشتر آید
درین تیمار گر یک دم غم تو
نپرسد حال من، جانم برآید
مرا شادی گهی باشد درین غم
که اندوه توام از در در آید
مرا یک ذره اندوه تو خوشتر
که یک عالم پر از سیم و زر آید
اگرچه هر کسی از غم گریزد
مرا چون جان ، غم تو درخور آید
مرا در سینه تاب انده تو
بسی خوشتر ز آب کوثر آید
چو سر در پای اندوه تو افکند
عراقی در دو عالم بر سر آید
زان پیش که دل ز جان برآید
جان از تن ناتوان برآید
بنمای جمال، تا دهم جان
کان سود بر این زیان برآید
ای کاش به جان برآمدی کار
این کار کجا به جان برآید؟
کارم نه چنان فتاد مشکل
کان بی‌تو به این و آن برآید
هم از در تو گشایدم کار
کامم همه زان دهان برآید
بر درگهت آمدم به کاری
کان بر تو به رایگان برآید
نایافته جانم از تو بویی
مگذار که ناگهان برآید
بنواز به لطف جانم، آن دم
کز کالبدم روان برآید
کام دل خستهٔ عراقی
از لطف تو بی‌گمان برآید
آخر این تیره شب هجر به پایان آید
آخر این درد مرا نوبت درمان آید
چند گردم چو فلک گرد جهان سرگردان؟
آخر این گردش ما نیز به پایان آید
آخر این بخت من از خواب درآید سحری
روز آخر نظرم بر رخ جانان آید
یافتم صحبت آن یار، مگر روزی چند
این همه سنگ محن بر سر ما زان آید
تا بود گوی دلم در خم چوگان هوس
کی مرا گوی غرض در خم چوگان آید؟
یوسف گم شده را گرچه نیابم به جهان
لاجرم سینهٔ من کلبهٔ احزان آید
بلبل‌آسا همه شب تا به سحر ناله زنم
بو که بویی به مشامم ز گلستان آید
او چه خواهد؟ که همی با وطن آید، لیکن
تا خود از درگه تقدیر چه فرمان آید
به عراق ار نرسد باز عراقی چه عجب!
که نه هر خار و خسی لایق بستان آید
صبا وقت سحر گویی ز کوی یار می‌آید
که بوی او شفای جان هر بیمار می‌آید
نسیم خوش مگر از باغ جلوه می‌دهد گل را
که آواز خوش از هر سو ز خلقی زار می‌آید
بیا در گلشن ای بی‌دل، به بوی گل برافشان جان
که از گلزار و گل امروز بوی یار می‌آید
گل از شادی همی خندد، من از غم زار می‌گریم
که از گلشن مرا یاد از رخ دلدار می‌آید
ز بستان هیچ در چشمم نمی‌آید، مگر آبی
که در چشمم ز یاد او دمی صدبار می‌آید
اگر گلزار می‌آید کسی را خوش، مرا باری
نسیم کوی او خوشتر ز صد گلزار می‌آید
مرا چه از گل و گلزار؟ کاندر دست امیدم
ز گلزار وصال یار زخم خار می‌آید
عراقی خسته دل هردم ز سویی می‌خورد زخمی
همه زخم بلا گویی برین افگار می‌آید
صبا وقت سحر، گویی، ز کوی یار می‌آید
که بوی او شفای جان هر بیمار می‌آید
نسیم او مگر در باغ جلوه می‌دهد گل را
که آواز خوش بلبل ز هر سو زار می‌آید
مگر از زلف دلدارم صبا بویی به باغ آورد
که از باغ و گل و گلزار بوی یار می‌آید
از آن چون بلبل بی‌دل ز رنگ و بوی گل شادم
که از گلزار در چشمم رخ دلدار می‌آید
گر آید در نظر کس را به جز رخسار او رویی
مرا باری نظر دایم بر آن رخسار می‌آید
مرا از هرچه در عالم به چشم اندر نیامد هیچ
مگر آبی که در چشمم دمی صد بار می‌آید
چو اندر آب عکس یار خوشتر می‌شود پیدا
از آنروز آب در چشمم مگر بسیار می‌آید
جهان آب است و من در وی جمال یار می‌بینم
ازینجا خواب در چشمم مگر بسیار می‌آید
عراقی در چنین خوابی همی بیند چنان رویی
از آن در خاطرش هر دم هزاران کار می‌آید
گهی درد تو درمان می‌نماید
گهی وصل تو هجران می‌نماید
دلی کو یافت از وصل تو درمان
همه دشوارش آسان می‌نماید
مرا گه گه به دردی یاد می‌کن
که دردت مرهم جان می‌نماید
بپرس آخر که: بی تو چونم، ای جان،
که جانم بس پریشان می‌نماید
مرا جور و جفا و رنج و محنت
غمت هردم دگرسان می‌نماید
ز جان سیر آمدم بی‌روی خوبت
جهان بر من چو زندان می‌نماید
عراقی خود ندارد چشم، ورنه
رخت خورشید تابان می‌نماید"
