author,book,text
ferdousi,shahname,"
یکایک به شاه آمد این آگهی
که سام آمد از کوه با فرّهی
بدان آگهی شد منوچهر شاد
بسی از جهان آفرین کرد یاد
بفرمود تا نوذر نامدار
شود تازیان پیش سام سوار
کند آفرین کیانی بر اوی
بدان شادمانی که بگشاد روی
بفرمایدش تا سوی شهریار
شود تا سخن‌ها کند خواستار
ببیند یکی روی دستان سام
به دیدار ایشان شود شادکام
و زین جا سوی زابلستان شود
بر آیین خسرو پرستان شود
چو نوذر بر سام نیرم رسید
یکی نو جهان پهلوان را بدید
فرود آمد از باره سام سوار
گرفتند مر یک‌دگر را کنار
ز شاه و ز گردان بپرسید سام
از ایشان بدو داد نوذر پیام
چو بشنید پیغام شاه بزرگ
زمین را ببوسید سام سترگ
دوان سوی درگاه بنهاد روی
چنان کش بفرمود دیهیم جوی
چو آمد به نزدیکی شهریار
سپهبد پذیره شدش از کنار
درفش منوچهر چون دید سام
پیاده شد از باره بگذارد گام
منوچهر فرمود تا برنشست
مر آن پاک‌دل گرد خسرو پرست
سوی تخت و ایوان نهادند روی
چه دیهیم دار و چه دیهیم جوی
منوچهر برگاه بنشست شاد
کلاه بزرگی به سر برنهاد
به یک دست قارن به یک دست سام
نشستند روشن‌دل و شادکام
پس آراسته زال را پیش شاه
به زرّین عمود و به رزّین کلاه
گرازان بیاورد سالار بار
شگفتی بماند اندر او شهریار
بر آن برز بالای آن خوب چهر
تو گفتی که آرام جان است و مهر
چنین گفت مر سام را شهریار
که از من تو این را به زنهاردار
به خیره میازارش از هیچ روی
به کس شادمانه مشو جز بدوی
که فرّ کیان دارد و چنگ شیر
دل هوشمندان و آهنگ شیر
پس از کار سیمرغ و کوه بلند
و زان تا چرا خوار شد ارجمند
یکایک همه سام با او بگفت
هم از آشکارا هم اندر نهفت
و ز افگندن زال بگشاد راز
که چون گشت با او سپهر از فراز
سرانجام گیتی ز سیمرغ و زال
پر از داستان شد به بسیار سال
برفتم به فرمان گیهان خدای
به البرز کوه اندر آن زشت جای
یکی کوه دیدم سر اندر سحاب
سپهری است گفتی ز خارا بر آب
برو بر نشیمی چو کاخ بلند
ز هر سوی بر او بسته راه گزند
بدو اندرون بچهٔ مرغ و زال
تو گفتی که هستند هر دو همال
همی بوی مهر آمد از باد اوی
به دل راحت آمد هم از یاد اوی
ابا داور راست گفتم به راز
که ای آفرینندهٔ بی‌نیاز
رسیده به هر جای برهان تو
نگردد فلک جز به فرمان تو
یکی بنده‌ام با تنی پر گناه
به پیش خداوند خورشید و ماه
امیدم به بخشایش تو است بس
به چیزی دگر نیستم دسترس
تو این بندهٔ مرغ پرورده را
به خواری و زاری برآورده را
همی پرّ پوشد به جای حریر
مزد گوشت هنگام پستان شیر
به بد مهری من روانم مسوز
به من باز بخش و دلم بر فروز
به فرمان یزدان چو این گفته شد
نیایش همانگه پذیرفته شد
بزد پرّ سیمرغ و بر شد به ابر
همی حلقه زد بر سر مرد گبر
ز کوه اندر آمد چو ابر بهار
گرفته تن زال را بر کنار
به پیش من آورد چون دایه‌ای
که در مهر باشد ورا مایه‌ای
من آوردمش نزد شاه جهان
همه آشکاراش کردم نهان
بفرمود پس شاه با موبدان
ستاره‌شناسان و هم بخردان
که جویند تا اختر زال چیست
بر آن اختر از بخت سالار کیست
چو گیرد بلندی چه خواهد بدن
همی داستان از چه خواهد زدن
ستاره‌شناسان هم اندر زمان
از اختر گرفتند پیدا نشان
بگفتند با شاه دیهیم دار
که شادان بزی تا بود روزگار
که او پهلوانی بود نامدار
سرافراز و هشیار و گرد و سوار
چو بشنید شاه این سخن شاد شد
دل پهلوان از غم آزاد شد
یکی خلعتی ساخت شاه زمین
که کردند هر کس بدو آفرین
از اسپان تازی به زرین ستام
ز شمشیر هندی به زرّین نیام
ز دینار و خز و ز یاقوت و زر
ز گستردنی‌های بسیار مر
غلامان رومی به دیبای روم
همه گوهرش پیکر و زرش بوم
زبرجد طبق‌ها و پیروزه جام
چه از زرّ سرخ و چه از سیم خام
پر از مشک و کافور و پر زعفران
همه پیش بردند فرمان بران
همان جوشن و ترگ و برگستوان
همان نیزه و تیر و گرز گران
همان تخت پیروزه و تاج زر
همان مهر یاقوت و زرین کمر
و زان پس منوچهر عهدی نوشت
سراسر ستایش به سان بهشت
همه کابل و زابل و مای و هند
ز دریای چین تا به دریای سند
ز زابلستان تا بدان روی بست
به نوّی نوشتند عهدی درست
چو این عهد و خلعت بیاراستند
پس اسپ جهان پهلوان خواستند
چو این کرده شد سام بر پای خاست
که ای مهربان مهتر داد و راست
ز ماهی بر اندیشه تا چرخ ماه
چو تو شاه ننهاد بر سر کلاه
به مهر و به داد و به خوی و خرد
زمانه همی از تو رامش برد
همه گنج گیتی به چشم تو خوار
مبادا ز تو نام تو یادگار
فرود آمد و تخت را داد بوس
ببستند بر کوههٔ پیل کوس
سوی زابلستان نهادند روی
نظاره بر او بر همه شهر و کوی
چو آمد به نزدیکی نیمروز
خبر شد ز سالار گیتی فروز
بیاراسته سیستان چون بهشت
گلش مشک سارا بُد و زرّ خشت
بسی مشک و دینار بر ریختند
بسی زعفران و درم بیختند
یکی شادمانی بُد اندر جهان
سراسر میان کهان و مهان
هر آن‌جا که بد مهتری نامجوی
ز گیتی سوی سام بنهاد روی
که فرخنده بادا پی این جوان
بر این پاک دل نامور پهلوان
چو بر پهلوان آفرین خواندند
ابر زال زر گوهر افشاندند
نشست آنگهی سام با زیب و جام
همی داد چیز و همی راند کام
کسی کو به خلعت سزاوار بود
خردمند بود و جهاندار بود
براندازه‌شان خلعت آراستند
همه پایهٔ برتری خواستند
جهاندیدگان را ز کشور بخواند
سخن‌های بایسته چندی براند
چنین گفت با نامور بخردان
که ای پاک و بیدار دل موبدان
چنین است فرمان هشیار شاه
که لشکر همی راند باید به راه
سوی گرگساران و مازندران
همی راند خواهم سپاهی گران
بماند به نزد شما این پسر
که همتای جان است و جفت جگر
دل و جانم ایدر بماند همی
مژه خون دل برفشاند همی
به گاه جوانی و کند آوری
یکی بیهده ساختم داوری
پسر داد یزدان بیانداختم
ز بی‌دانشی ارج نشناختم
گرانمایه سیمرغ برداشتش
همان آفریننده بگماشتش
بپرورد او را چو سرو بلند
مرا خوار بد مرغ را ارجمند
چو هنگام بخشایش آمد فراز
جهاندار یزدان به من داد باز
بدانید کاین زینهار من است
به نزد شما یادگار من است
گرامیش دارید و پندش دهید
همه راه و رای بلندش دهید
سوی زال کرد آنگهی سام روی
که داد و دهش گیر و آرام جوی
چنان دان که زابلستان خان تست
جهان سر به سر زیر فرمان تست
تو را خان و مان باید آبادتر
دل دوستداران تو شادتر
کلید در گنج‌ها پیش تو است
دلم شاد و غمگین به کم بیش تو است
به سام آنگهی گفت زال جوان
که چون زیست خواهم من ایدر نوان
جدا پیش‌تر زین کجا داشتی
مدارم که آمد گه آشتی
کسی کو ز مادر گنه کار زاد
من آنم سزد گر بنالم ز داد
گهی زیر چنگال مرغ اندرون
چمیدن به خاک و چریدن ز خون
کنون دور ماندم ز پروردگار
چنین پروراند مرا روزگار
ز گل بهرهٔ من به جز خار نیست
بدین با جهاندار پیگار نیست
بدو گفت پرداختن دل سزاست
بپرداز و بر گوی هرچت هواست
ستاره شمر مرد اخترگرای
چنین زد تو را ز اختر نیک رای
که ایدر تو را باشد آرامگاه
هم ایدر سپاه و هم ایدر کلاه
گذر نیست بر حکم گردان سپهر
هم ایدر بگسترد بایدت مهر
کنون گرد خویش اندر آور گروه
سواران و مردان دانش پژوه
بیاموز و بشنو ز هر دانشی
که یابی ز هر دانشی رامشی
ز خورد و ز بخشش میاسای هیچ
همه دانش و داد دادن بسیچ
بگفت این و برخاست آوای کوس
هوا قیرگون شد زمین آبنوس
خروشیدن زنگ و هندی درای
برآمد ز دهلیز پرده سرای
سپهبد سوی جنگ بنهاد روی
یکی لشکری ساخته جنگجوی
بشد زال با او دو منزل به راه
بدان تا پدر چون گذارد سپاه
پدر زال را تنگ در برگرفت
شگفتی خروشیدن اندر گرفت
بفرمود تا بازگردد ز راه
شود شادمان سوی تخت و کلاه
بیامد پر اندیشه دستان سام
که تا چون زید تا بود نیک نام
نشست از بر نامور تخت عاج
به سر بر نهاد آن فروزنده تاج
ابا یاره و گرزهٔ گاو سر
ابا طوق زرّین و زرّین کمر
ز هر کشوری موبدان را بخواند
پژوهید هر کار و هر چیز راند
ستاره‌شناسان و دین آوران
سواران جنگی و کین‌آوران
شب و روز بودند با او به هم
زدندی همی رای بر بیش و کم
چنان گشت زال از بس آموختن
تو گفتی ستاره است از افروختن
به رای و به دانش به جایی رسید
که چون خویشتن در جهان کس ندید
بدین سان همی گشت گردان سپهر
ابر سام و بر زال گسترده مهر"
ferdousi,shahname,"
چنان بد که روزی چنان کرد رای
که در پادشاهی بجنبد ز جای
برون رفت با ویژه‌گردان خویش
که با او یکی بودشان رای و کیش
سوی کشور هندوان کرد رای
سوی کابل و دنبر و مرغ و مای
به هر جایگاهی بیاراستی
می و رود و رامشگران خواستی
گشاده در گنج و افگنده رنج
بر آیین و رسم سرای سپنج
ز زابل به کابل رسید آن زمان
گرازان و خندان و دل شادمان
یکی پادشا بود مهراب نام
زبر دست با گنج و گسترده کام
به بالا به کردار آزاده سرو
به رخ چون بهار و به رفتن تذرو
دل بخردان داشت و مغز ردان
دو کتف یلان و هش موبدان
ز ضحاک تازی گهر داشتی
به کابل همه بوم و برداشتی
همی داد هر سال مر سام ساو
که با او به رزمش نبود ایچ تاو
چو آگه شد از کار دستان سام
ز کابل بیامد به هنگام بام
ابا گنج و اسپان آراسته
غلامان و هر گونه‌ای خواسته
ز دینار و یاقوت و مشک و عبیر
ز دیبای زربفت و چینی حریر
یکی تاج با گوهر شاهوار
یکی طوق زرین زبرجد نگار
چو آمد به دستان سام آگهی
که مهراب آمد بدین فرهی
پذیره شدش زال و بنواختش
به آیین یکی پایگه ساختش
سوی تخت پیروزه باز آمدند
گشاده دل و بزم ساز آمدند
یکی پهلوانی نهادند خوان
نشستند بر خوان با فرخان
گسارندهٔ می می آورد و جام
نگه کرد مهراب را پور سام
خوش آمد هماناش دیدار او
دلش تیز تر گشت در کار او
چو مهراب برخاست از خوان زال
نگه کرد زال اندر آن برز و یال
چنین گفت با مهتران زال زر
که زیبنده‌تر زین که بندد کمر
یکی نامدار از میان مهان
چنین گفت کای پهلوان جهان
پس پردهٔ او یکی دخترست
که رویش ز خورشید روشن‌ترست
ز سر تا به پایش به کردار عاج
به رخ چون بهشت و به بالا چو ساج
بر  آن سفت سیمنش مشکین کمند
سرش گشته چون حلقهٔ پای‌بند
رخانش چو گلنار و لب ناردان
ز سیمین برش رسته دو ناروان
دو چشمش به سان دو نرگس به باغ
مژه تیرگی برده از پر زاغ
دو ابرو به سان کمان طراز
بر او توز پوشیده از مشک ناز
بهشتیست سرتاسر آراسته
پر آرایش و رامش و خواسته
برآورد مر زال را دل به جوش
چنان شد کزو رفت آرام وهوش
شب آمد پر اندیشه بنشست زال
به نادیده برگشت بی‌خورد و هال
چو زد بر سر کوه بر تیغ شید
چو یاقوت شد روی گیتی سپید
در بار بگشاد دستان سام
برفتند گردان به زرین نیام
در پهلوان را بیاراستند
چو بالای پرمایگان خواستند
برون رفت مهراب کابل خدای
سوی خیمهٔ زال زابل خدای
چو آمد به نزدیکی بارگاه
خروش آمد از در که بگشای راه
بر پهلوان اندرون رفت گو
به سان درختی پر از بار نو
دل زال شد شاد و بنواختش
از آن انجمن سر برافراختش
بپرسید کز من چه خواهی بخواه
ز تخت و ز مهر و ز تیغ و کلاه
بدو گفت مهراب کای پادشا
سرافراز و پیروز و فرمان روا
مرا آرزو در زمانه یکیست
که آن آرزو بر تو دشوار نیست
که آیی به شادی سوی خان من
چو خورشید روشن کنی جان من
چنین داد پاسخ که این رای نیست
به خان تو اندر مرا جای نیست
نباشد بدین سام همداستان
همان شاه چون بشنود داستان
که ما می گساریم و مستان شویم
سوی خانهٔ بت پرستان شویم
جز آن هر چه گویی تو پاسخ دهم
به دیدار تو رای فرخ نهم
چو بشنید مهراب کرد آفرین
به دل زال را خواند ناپاک دین
خرامان برفت از بر تخت اوی
همی آفرین خواند بر بخت اوی
چو دستان سام از پسش بنگرید
ستودش فراوان چنان چون سزید
از آن کو نه هم دین و هم راه بود
زبان از ستودنش کوتاه بود
بر او هیچکس چشم نگماشتند
مر او را ز دیوانگان داشتند
چو روشن دل پهلوان را بدوی
چنان گرم دیدند با گفت‌وگوی
مر او را ستودند یک یک مهان
همان کز پس پرده بودش نهان
ز بالا و دیدار و آهستگی
ز بایستگی هم ز شایستگی
دل زال یکباره دیوانه گشت
خرد دور شد عشق فرزانه گشت
سپهدار تازی سر راستان
بگوید بر این بر یکی داستان
که تا زنده‌ام چرمه جفت منست
خم چرخ گردان نهفت منست
عروسم نباید که رعنا شوم
به نزد خردمند رسوا شوم
از اندیشگان زال شد خسته دل
بر آن کار بنهاد پیوسته دل
همی بود پیچان دل از گفت‌وگوی
مگر تیره گردد از این آبروی
همی گشت یک چند بر سر سپهر
دل زال آگنده یکسر به مهر"
ferdousi,shahname,"
چنان بد که مهراب روزی پگاه
برفت و بیامد از آن بارگاه
گذر کرد سوی شبستان خویش
همی گشت بر گرد بستان خویش
دو خورشید بود اندر ایوان او
چو سیندخت و رودابهٔ ماه روی
بیاراسته همچو باغ بهار
سراپای پر بوی و رنگ و نگار
شگفتی به رودابه اندر بماند
همی نام یزدان بر او بر بخواند
یکی سرو دید از برش گرد ماه
نهاده ز عنبر به سر بر کلاه
به دیبا و گوهر بیاراسته
به سان بهشتی پر از خواسته
بپرسید سیندخت مهراب را
ز خوشاب بگشاد عناب را
که چون رفتی امروز و چون آمدی
که کوتاه باد از تو دست بدی
چه مردست این پیر سر پور سام
همی تخت یاد آیدش گر کنام
خوی مردمی هیچ دارد همی
پی نامداران سپارد همی
چنین داد مهراب پاسخ بدوی
که ای سرو سیمین بر ماه روی
به گیتی در از پهلوانان گرد
پی زال زر کس نیارد سپرد
چو دست و عنانش بر ایوان نگار
نبینی نه بر زین چون او یک سوار
دل شیر نر دارد و زور پیل
دو دستش به کردار دریای نیل
چو بر گاه باشد در افشان بود
چو در جنگ باشد سر افشان بود
رخش پژمرانندهٔ ارغوان
جوان سال و بیدار و بختش جوان
به کین اندرون چون نهنگ بلاست
به زین اندرون تیز چنگ اژدهاست
نشانندهٔ خاک در کین به خون
فشانندهٔ خنجر آبگون
از آهو همان کش سپیدست موی
بگوید سخن مردم عیب جوی
سپیدی مویش بزیبد همی
تو گویی که دلها فریبد همی
چو بشنید رودابه آن گفت‌گوی
برافروخت و گلنارگون کرد روی
دلش گشت پرآتش از مهر زال
از او دور شد خورد و آرام و هال
چو بگرفت جای خرد آرزوی
دگر شد به رای و به آیین و خوی
ورا پنج ترک پرستنده بود
پرستنده و مهربان بنده بود
بدان بندگان خردمند گفت
که بگشاد خواهم نهان از نهفت
شما یک به یک رازدار منید
پرستنده و غمگسار منید
بدانید هر پنج و آگه بوید
همه ساله با بخت همره بوید
که من عاشقم همچو بحر دمان
از او بر شده موج تا آسمان
پر از پور سامست روشن دلم
به خواب اندر اندیشه زو نگسلم
همیشه دلم در غم مهر اوست
شب و روزم اندیشهٔ چهر اوست
کنون این سخن را چه درمان کنید
چه گویید و با من چه پیمان کنید
یکی چاره باید کنون ساختن
دل و جانم از رنج پرداختن
پرستندگان را شگفت آمد آن
که بیکاری آمد ز دخت ردان
همه پاسخش را بیاراستند
چو اهرمن از جای برخاستند
که ای افسر بانوان جهان
سرافراز بر دختران مهان
ستوده ز هندوستان تا به چین
میان بتان در چو روشن نگین
به بالای تو بر چمن سرو نیست
چو رخسار تو تابش پرو نیست
نگار رخ تو ز قنوج و رای
فرستد همی سوی خاور خدای
ترا خود به دیده درون شرم نیست
پدر را به نزد تو آزرم نیست
که آن را که اندازد از بر پدر
تو خواهی که گیری مر او را به بر
که پروردهٔ مرغ باشد به کوه
نشانی شده در میان گروه
کس از مادران پیر هرگز نزاد
نه ز آن کس که زاید بباشد نژاد
چنین سرخ دو بسد شیر بوی
شگفتی بود گر شود پیرجوی
جهانی سراسر پر از مهر تست
به ایوانها صورت چهر تست
ترا با چنین روی و بالای و موی
ز چرخ چهارم خور آیدت شوی
چو رودابه گفتار ایشان شنید
چو از باد آتش دلش بردمید
بر ایشان یکی بانگ برزد به خشم
بتابید روی و بخوابید چشم
وز آن پس به چشم و به روی دژم
به ابرو ز خشم اندر آورد خم
چنین گفت کاین خام پیکارتان
شنیدن نیرزید گفتارتان
نه قیصر بخواهم نه فغفور چین
نه از تاجداران ایران زمین
به بالای من پور سامست زال
ابا بازوی شیر و با برز و یال
گرش پیر خوانی همی گر جوان
مرا او به جای تنست و روان
مرا مهر او دل ندیده گزید
همان دوستی از شنیده گزید
بر او مهربانم به بر روی و موی
به سوی هنر گشتمش مهرجوی
پرستنده آگه شد از راز او
چو بشنید دل خسته آواز او
به آواز گفتند ما بنده‌ایم
به دل مهربان و پرستنده‌ایم
نگه کن کنون تا چه فرمان دهی
نیاید ز فرمان تو جز بهی
یکی گفت ز ایشان که ای سرو بن
نگر تا نداند کسی این سخن
اگر جادویی باید آموختن
به بند و فسون چشمها دوختن
بپریم با مرغ و جادو شویم
بپوییم و در چاره آهو شویم
مگر شاه را نزد ماه آوریم
به نزدیک او پایگاه آوریم
لب سرخ رودابه پرخنده کرد
رخان معصفر سوی بنده کرد
که این گفته را گر شوی کاربند
درختی برومند کاری بلند
که هر روز یاقوت بار آورد
برش تازیان بر کنار آورد"
