author,book,text
ferdousi,shahname,"
چو برداشت پرده ز پیش آفتاب
سپیده برآمد بپالود خواب
دو بیهوده را دل بدان کار گرم
که دیده بشویند هر دو ز شرم
برفتند هر دو گرازان ز جای
نهادند سر سوی پرده‌سرای
چو از خیمه ایرج به ره بنگرید
پر از مهر دل پیش ایشان دوید
برفتند با او به خیمه درون
سخن بیشتر بر چرا رفت و چون
بدو گفت تور ار تو از ما کهی
چرا برنهادی کلاه مهی؟
ترا باید ایران و تخت کیان
مرا بر در ترک بسته میان؟
برادر که مهتر به خاور به رنج
به سر بر ترا افسر و زیر گنج؟
چنین بخششی کان جهانجوی کرد
همه سوی کهتر پسر روی کرد
نه تاج کیان مانم اکنون نه گاه
نه نام بزرگی نه ایران سپاه
چو از تور بشنید ایرج سخن
یکی پاکتر پاسخ افگند بن
بدو گفت کای مهتر کام جوی
اگر کام دل خواهی آرام جوی
من ایران نخواهم نه خاور نه چین
نه شاهی نه گسترده روی زمین
بزرگی که فرجام او تیرگیست
برآن مهتری بر بباید گریست
سپهر بلند ار کشد زین تو
سرانجام خشتست بالین تو
مرا تخت ایران اگر بود زیر
کنون گشتم از تاج و از تخت سیر
سپردم شما را کلاه و نگین
بدین روی با من مدارید کین
مرا با شما نیست ننگ و نبرد
روان را نباید برین رنجه کرد
زمانه نخواهم به آزارتان
اگر دور مانم ز دیدارتان
جز از کهتری نیست آیین من
مباد آز و گردن‌کشی دین من
چو بشنید تور از برادر چنین
به ابرو ز خشم اندر آورد چین
نیامدش گفتار ایرج پسند
نبد راستی نزد او ارجمند
به کرسی به خشم اندر آورد پای
همی‌گفت و برجست هزمان ز جای
یکایک برآمد ز جای نشست
گرفت آن گران کرسی زر به دست
بزد بر سر خسرو تاجدار
از او خواست ایرج به جان زینهار
نیایدت گفت ایچ بیم از خدای؟
نه شرم از پدر خود همین است رای
مکش مر مرا کت سرانجام کار
بپیچاند از خون من کردگار
مکن خویشتن را ز مردم‌کشان
کزین پس نیابی ز من خود نشان
بسنده کنم زین جهان گوشه‌ای
به کوشش فراز آورم توشه‌ای
به خون برادر چه بندی کمر؟
چه سوزی دل پیر گشته پدر؟
جهان خواستی یافتی خون مریز
مکن با جهاندار یزدان ستیز
سخن را چو بشنید پاسخ نداد
همان گفتن آمد همان سرد باد
یکی خنجر آبگون برکشید
سراپای او چادر خون کشید
بدان تیز زهرآبگون خنجرش
همی‌کرد چاک آن کیانی برش
فرود آمد از پای سرو سهی
گسست آن کمرگاه شاهنشهی
روان خون از آن چهرهٔ ارغوان
شد آن نامور شهریار جوان
جهانا بپروردیش در کنار
وز آن پس ندادی به جان زینهار
نهانی ندانم ترا دوست کیست
بدین آشکارت بباید گریست
سر تاجور ز آن تن پیلوار
به خنجر جدا کرد و برگشت کار
بیاگند مغزش به مشک و عبیر
فرستاد نزد جهان‌بخش پیر
چنین گفت کاینت سر آن نیاز
که تاج نیاگان بدو گشت باز
کنون خواه تاجش ده و خواه تخت
شد آن سایه‌گستر نیازی درخت
برفتند باز آن دو بیداد شوم
یکی سوی ترک و یکی سوی روم
فریدون نهاده دو دیده به راه
سپاه و کلاه آرزومند شاه
چو هنگام برگشتن شاه بود
پدر زان سخن خود کی آگاه بود
همی شاه را تخت پیروزه ساخت
همی تاج را گوهر اندر نشاخت
پذیره شدن را بیاراستند
می و رود و رامشگران خواستند
تبیره ببردند و پیل از درش
ببستند آذین به هر کشورش
به زین اندرون بود شاه و سپاه
یکی گرد تیره برآمد ز راه
هیونی برون آمد از تیره گرد
نشسته برو سوگواری به درد
خروشی برآورد دل سوگوار
یکی زر تابوتش اندر کنار
به تابوت زر اندرون پرنیان
نهاده سر ایرج اندر میان
ابا ناله و آه و با روی زرد
به پیش فریدون شد آن شوخ مرد
ز تابوت زر تخته برداشتند
که گفتار او خوار پنداشتند
ز تابوت چون پرنیان برکشید
سر ایرج آمد بریده پدید
بیافتاد ز اسپ آفریدون به خاک
سپه سر به سر جامه کردند چاک
سیه شد رخ و دیدگان شد سپید
که دیدن دگرگونه بودش امید
چو خسرو بران‌گونه آمد ز راه
چنین بازگشت از پذیره سپاه
دریده درفش و نگونسار کوس
رخ نامداران به رنگ آبنوس
تبیره سیه کرده و روی پیل
پراکنده بر تازی اسپانش نیل
پیاده سپهبد پیاده سپاه
پر از خاک سر برگرفتند راه
خروشیدن پهلوانان به درد
کنان گوشت تن را بران رادمرد
برین گونه گردد به ما بر سپهر
بخواهد ربودن چو بنمود چهر
مبر خود به مهر زمانه گمان
نه نیکو بود راستی در کمان
چو دشمنش گیری نمایدت مهر
و گر دوست خوانی نبینیش چهر
یکی پند گویم ترا من درست
دل از مهر گیتی ببایدت شست
سپه داغ دل شاه با های و هوی
سوی باغ ایرج نهادند روی
به روزی کجا جشن شاهان بدی
وزان پیشتر بزمگاهان بدی
فریدون سر شاه پور جوان
بیامد ببر برگرفته نوان
بر آن تخت شاهنشهی بنگرید
سر شاه را نزدر تاج دید
همان حوض شاهان و سرو سهی
درخت گلفشان و بید و بهی
تهی دید از آزادگان جشنگاه
به کیوان برآورده گرد سیاه
همی سوخت باغ و همی خست روی
همی ریخت اشک و همی کند موی
میان را به زناز خونین ببست
فکند آتش اندر سرای نشست
گلستانش برکند و سروان بسوخت
به یکبارگی چشم شادی بدوخت
نهاده سر ایرج اندر کنار
سر خویشتن کرد زی کردگار
همی گفت کای داور دادگر
بدین بی‌گنه کشته اندر نگر
به خنجر سرش کنده در پیش من
تنش خورده شیران آن انجمن
دل هر دو بیداد از آن سان بسوز
که هرگز نبینند جز تیره روز
به داغی جگرشان کنی آژده
که بخشایش آرد بریشان دده
همی خواهم از روشن کردگار
که چندان زمان یابم از روزگار
که از تخم ایرج یکی نامور
بیاید برین کین ببندد کمر
چو دیدم چنین زان سپس شایدم
اگر خاک بالا بپیمایدم
برین‌گونه بگریست چندان بزار
همی تا گیا رستش اندر کنار
زمین بستر و خاک بالین او
شده تیره روشن جهان‌بین او
در بار بسته گشاده زبان
همی گفت کای داور راستان
کس از تاجداران بدین‌سان نمرد
که مردست این نامبردار گرد
سرش را بریده به زار اهرمن
تنش را شده کام شیران کفن
خروشی به زاری و چشمی پرآب
ز هر دام و دد برده آرام و خواب
سراسر همه کشورش مرد و زن
به هر جای کرده یکی انجمن
همه دیده پرآب و دل پر ز خون
نشسته به تیمار و گرم اندرون
همه جامه کرده کبود و سیاه
نشسته به اندوه در سوگ شاه
چه مایه چنین روز بگذاشتند
همه زندگی مرگ پنداشتند"
ferdousi,shahname,"
برآمد برین نیز یک چندگاه
شبستان ایرج نگه کرد شاه
یکی خوب و چهره پرستنده دید
کجا نام او بود ماه‌آفرید
که ایرج برو مهر بسیار داشت
قضا را کنیزک ازو بار داشت
پری چهره را بچه بود در نهان
از آن شاد شد شهریار جهان
از آن خوب‌رخ شد دلش پرامید
به کین پسر داد دل را نوید
چو هنگامهٔ زادن آمد پدید
یکی دختر آمد ز ماه آفرید
جهانی گرفتند پروردنش
برآمد به ناز و بزرگی تنش
مر آن ماه‌رخ را ز سر تا به پای
تو گفتی مگر ایرجستی به جای
چو بر جست و آمدش هنگام شوی
چو پروین شدش روی و چون مشک موی
نیا نامزد کرد شویش پشنگ
بدو داد و چندی برآمد درنگ
یکی پور زاد آن هنرمند ماه
چگونه سزاوار تخت و کلاه
چو از مادر مهربان شد جدا
سبک تاختندش به نزد نیا
بدو گفت موبد که ای تاجور
یکی شادکن دل به ایرج نگر
جهان‌بخش را لب پر از خنده شد
تو گفتی مگر ایرجش زنده شد
نهاد آن گرانمایه را برکنار
نیایش همی کرد با کردگار
همی گفت کاین روز فرخنده باد
دل بدسگالان ما کنده باد
همان کز جهان آفرین کرد یاد
ببخشود و دیده بدو باز داد
فریدون چو روشن جهان را بدید
به چهر نوآمد سبک بنگرید
چنین گفت کز پاک مام و پدر
یکی شاخ شایسته آمد به بر
می روشن آمد ز پرمایه جام
مر آن چهر دارد منوچهر نام
چنان پروردیدش که باد هوا
برو بر گذشتی نبودی روا
پرستنده‌ای کش به بر داشتی
زمین را به پی هیچ نگذاشتی
به پای اندرش مشک سارا بدی
روان بر سرش چتر دیبا بدی
چنین تا برآمد برو سالیان
نیامدش ز اختر زمانی زیان
هنرها که آید شهان را به کار
بیاموختش نامور شهریار
چو چشم و دل پادشا باز شد
سپه نیز با او هم آواز شد
نیا تخت زرین و گرز گران
بدو داد و پیروزه تاج سران
سراپردهٔ دیبهٔ هفت‌رنگ
بدو اندرون خیمه‌های پلنگ
چه اسپان تازی به زرین ستام
چه شمشیر هندی به زرین نیام
چه از جوشن و ترگ و رومی زره
گشادند مر بندها را گره
کمانهای چاچی وتیر خدنگ
سپرهای چینی و ژوپین جنگ
برین گونه آراسته گنجها
که بودش به گرد آمده رنجها
سراسر سزای منوچهر دید
دل خویش را زو پر از مهر دید
کلید در گنج آراسته
به گنجور او داد با خواسته
همه پهلوانان لشکرش را
همه نامداران کشورش را
بفرمود تا پیش او آمدند
همه با دلی کینه‌جو آمدند
به شاهی برو آفرین خواندند
زبرجد به تاجش برافشاندند
چو جشنی بد این روزگار بزرگ
شده در جهان میش پیدا ز گرگ
سپهدار چون قارن کاوگان
سپهکش چو شیروی و چون آوگان
چو شد ساخته کار لشکر همه
برآمد سر شهریار از رمه
به سلم و به تور آمد این آگهی
که شد روشن آن تخت شاهنشهی
دل هر دو بیدادگر پر نهیب
که اختر همی رفت سوی نشیب
نشستند هر دو به اندیشگان
شده تیره روز جفاپیشگان
یکایک بران رایشان شد درست
کزان روی شان چاره بایست جست
که سوی فریدون فرستند کس
به پوزش کجا چاره این بود بس
بجستند از آن انجمن هردوان
یکی پاک دل مرد چیره‌زبان
بدان مرد باهوش و با رای و شرم
بگفتند با لابه بسیار گرم
در گنج خاور گشادند باز
بدیدند هول نشیب از فراز
ز گنج گهر تاج زر خواستند
همی پشت پیلان بیاراستند
به گردونه‌ها بر چه مشک و عبیر
چه دیبا و دینار و خز و حریر
ابا پیل گردونکش و رنگ و بوی
ز خاور به ایران نهادند روی
هر آنکس که بد بر در شهریار
یکایک فرستادشان یادگار
چو پردخته‌شان شد دل از خواسته
فرستاده آمد برآراسته
بدادند نزد فریدون پیام
نخست از جهاندار بردند نام
که جاوید باد آفریدون گرد
همه فرهی ایزد او را سپرد
سرش سبز باد و تنش ارجمند
منش برگذشته ز چرخ بلند
بدان کان دو بدخواه بیدادگر
پر از آب دیده ز شرم پدر
پشیمان شده داغ دل بر گناه
همی سوی پوزش نمایند راه
چه گفتند دانندگان خرد
که هر کس که بد کرد کیفر برد
بماند به تیمار و دل پر ز درد
چو ما مانده‌ایم ای شه رادمرد
نوشته چنین بودمان از بوش
به رسم بوش اندر آمد روش
هژبر جهانسوز و نر اژدها
ز دام قضا هم نیابد رها
و دیگر که فرمان ناپاک دیو
ببرد دل از ترس گیهان خدیو
به ما بر چنین خیره شد رای بد
که مغز دو فرزند شد جای بد
همی چشم داریم از آن تاجور
که بخشایش آرد به ما بر مگر
اگر چه بزرگست ما را گناه
به بی‌دانشی برنهد پیشگاه
و دیگر بهانه سپهر بلند
که گاهی پناهست و گاهی گزند
سوم دیو کاندر میان چون نوند
میان بسته دارد ز بهر گزند
اگر پادشا را سر از کین ما
شود پاک و روشن شود دین ما
منوچهر را با سپاه گران
فرستد به نزدیک خواهشگران
بدان تا چو بنده به پیشش به پای
بباشیم جاوید و اینست رای
مگر کان درختی کزین کین برست
به آب دو دیده توانیم شست
بپوییم تا آب و رنجش دهیم
چو تازه شود تاج و گنجش دهیم
فرستاده آمد دلی پر سخن
سخن را نه سر بود پیدا نه بن
ابا پیل و با گنج و با خواسته
به درگاه شاه آمد آراسته
به شاه آفریدون رسید آگهی
بفرمود تا تخت شاهنشهی
به دیبای چینی بیاراستند
کلاه کیانی بپیراستند
نشست از بر تخت پیروزه شاه
چو سرو سهی بر سرش گرد ماه
ابا تاج و با طوق و باگوشوار
چنان چون بود در خور شهریار
خجسته منوچهر بر دست شاه
نشسته نهاده به سر بر کلاه
به زرین عمود و به زرین کمر
زمین کرده خورشیدگون سر به سر
دو رویه بزرگان کشیده رده
سراپای یکسر به زر آژده
به یک دست بربسته شیر و پلنگ
به دست دگر ژنده پیلان جنگ
برون شد ز درگاه شاپور گرد
فرستادهٔ سلم را پیش برد
فرستاده چون دید درگاه شاه
پیاده دوان اندر آمد ز راه
چو نزدیک شاه آفریدون رسید
سر و تخت و تاج بلندش بدید
ز بالا فرو برد سر پیش اوی
همی بر زمین بر بمالید روی
گرانمایه شاه جهان کدخدای
به کرسی زرین ورا کرد جای
فرستاده بر شاه کرد آفرین
که ای نازش تاج و تخت و نگین
زمین گلشن از پایهٔ تخت تست
زمان روشن از مایهٔ بخت تست
همه بندهٔ خاک پای توایم
همه پاک زنده به رای توایم
پیام دو خونی به گفتن گرفت
همه راستیها نهفتن گرفت
گشاده زبان مرد بسیار هوش
بدو داده شاه جهاندار گوش
ز کردار بد پوزش آراستن
منوچهر را نزد خود خواستن
میان بستن او را بسان رهی
سپردن بدو تاج و تخت مهی
خریدن ازو باز خون پدر
بدینار و دیبا و تاج و کمر
فرستاده گفت و سپهبد شنید
مر آن بند را پاسخ آمد کلید
چو بشنید شاه جهان کدخدای
پیام دو فرزند ناپاک رای
یکایک بمرد گرانمایه گفت
که خورشید را چون توانی نهفت
نهان دل آن دو مرد پلید
ز خورشید روشن‌تر آمد پدید
شنیدم همه هر چه گفتی سخن
نگه کن که پاسخ چه یابی ز بن
بگو آن دو بی‌شرم ناپاک را
دو بیداد و بد مهر و ناباک را
که گفتار خیره نیرزد به چیز
ازین در سخن خود نرانیم نیز
اگر بر منوچهرتان مهر خاست
تن ایرج نامورتان کجاست
که کام دد و دام بودش نهفت
سرش را یکی تنگ تابوت جفت
کنون چون ز ایرج بپرداختید
به کین منوچهر بر ساختید
نبینید رویش مگر با سپاه
ز پولاد بر سر نهاده کلاه
ابا گرز و با کاویانی درفش
زمین کرده از سم اسپان بنفش
سپهدار چون قارن رزم زن
چو شاپور و نستوه شمشیر زن
به یک دست شیدوش جنگی به پای
چو شیروی شیراوژن رهنمای
چو سام نریمان و سرو یمن
به پیش سپاه اندرون رای زن
درختی که از کین ایرج برست
به خون برگ و بارش بخواهیم شست
از آن تاکنون کین او کس نخواست
که پشت زمانه ندیدیم راست
نه خوب آمدی با دو فرزند خویش
کجا جنگ را کردمی دست پیش
کنون زان درختی که دشمن بکند
برومند شاخی برآمد بلند
بیاید کنون چون هژبر ژیان
به کین پدر تنگ بسته میان
فرستاده آن هول گفتار دید
نشست منوچهر سالار دید
بپژمرد و برخاست لرزان ز جای
هم آنگه به زین اندر آورد پای
همه بودنیها به روشن روان
بدید آن گرانمایه مرد جوان
که با سلم و با تور گردان سپهر
نه بس دیر چین اندر آرد بچهر
بیامد به کردار باد دمان
سری پر ز پاسخ دلی پرگمان
ز دیدار چون خاور آمد پدید
به هامون کشیده سراپرده دید
بیامد به درگاه پرده سرای
به پرده درون بود خاور خدای
یکی خیمهٔ پرنیان ساخته
ستاره زده جای پرداخته
دو شاه دو کشور نشسته به راز
بگفتند کامد فرستاده باز
بیامد هم آنگاه سالار بار
فرستاده را برد زی شهریار
نشستنگهی نو بیاراستند
ز شاه نو آیین خبر خواستند
بجستند هر گونه‌ای آگهی
ز دیهیم و از تخت شاهنشهی
ز شاه آفریدون و از لشکرش
ز گردان جنگی و از کشورش
و دیگر ز کردار گردان سپهر
که دارد همی بر منوچهر مهر
بزرگان کدامند و دستور کیست
چه مایستشان گنج و گنجور کیست
فرستاده گفت آنکه روشن بهار
بدید و ببیند در شهریار
بهاری ست خرم در اردیبهشت
همه خاک عنبر همه زر خشت
سپهر برین کاخ و میدان اوست
بهشت برین روی خندان اوست
به بالای ایوان او راغ نیست
به پهنای میدان او باغ نیست
چو رفتم به نزدیک ایوان فراز
سرش با ستاره همی گفت راز
به یک دست پیل و به یک دست شیر
جهان را به تخت اندر آورده زیر
ابر پشت پیلانش بر تخت زر
ز گوهر همه طوق شیران نر
تبیره زنان پیش پیلان به پای
ز هر سو خروشیدن کره نای
تو گفتی که میدان بجوشد همی
زمین به آسمان بر خروشد همی
خرامان شدم پیش آن ارجمند
یکی تخت پیروزه دیدم بلند
نشسته برو شهریاری چو ماه
ز یاقوت رخشان به سر بر کلاه
چو کافور موی و چو گلبرگ روی
دل آزرم جوی و زبان چرب‌گوی
جهان را ازو دل به بیم و امید
تو گفتی مگر زنده شد جمشید
منوچهر چون زاد سرو بلند
به کردار طهمورث دیوبند
نشسته بر شاه بر دست راست
تو گویی زبان و دل پادشاست
به پیش اندرون قارن رزم زن
به دست چپش سرو شاه یمن
چو شاه یمن سرو دستورشان
چو پیروز گرشاسپ گنجورشان
شمار در گنجها ناپدید
کس اندر جهان آن بزرگی ندید
همه گرد ایوان دو رویه سپاه
به زرین عمود و به زرین کلاه
سپهدار چون قارن کاوگان
به پیش سپاه اندرون آوگان
مبارز چو شیروی درنده شیر
چو شاپور یل ژنده پیل دلیر
چنو بست بر کوههٔ پیل کوس
هوا گردد از گرد چون آبنوس
گر آیند زی ما به جنگ آن گروه
شود کوه هامون و هامون کوه
همه دل پر از کین و پرچین بروی
به جز جنگشان نیست چیز آرزوی
بریشان همه برشمرد آنچه دید
سخن نیز کز آفریدون شنید
دو مرد جفا پیشه را دل ز درد
بپیچید و شد رویشان لاژورد
نشستند و جستند هرگونه رای
سخن را نه سر بود پیدا نه پای
به سلم بزرگ آنگهی تور گفت
که آرام و شادی بباید نهفت
نباید که آن بچهٔ نره‌شیر
شود تیزدندان و گردد دلیر
چنان نامور بی‌هنر چون بود
کش آموزگار آفریدون بود
نبیره چو شد رای زن با نیا
ازان جایگه بردمد کیمیا
بباید بسیچید ما را بجنگ
شتاب آوریدن به جای درنگ
ز لشکر سواران برون تاختند
ز چین و ز خاور سپه ساختند
فتاد اندران بوم و بر گفت‌گوی
جهانی بدیشان نهادند روی
سپاهی که آن را کرانه نبود
بدان بد که اختر جوانه نبود
ز خاور دو لشکر به ایران کشید
بخفتان و خود اندرون ناپدید
ابا ژنده پیلان و با خواسته
دو خونی به کینه دل آراسته"
