author,book,text
saadi,golestan,"
هر که سلطان مرید او باشد
گر همه بد کند نکو باشد
و آن که را پادشه بیندازد
کسش از خیلخانه ننوازد
کسی به دیده انکار اگر نگاه کند
نشان صورت یوسف دهد به ناخوبی
و گر به چشم ارادت نگه کنی در دیو
فرشته‌ایت نماید به چشم کروبی
خواجه با بندهٔ پری رخسار
چون در آمد به بازی و خنده
نه عجب کاو چو خواجه حکم کند
واین کشد بار ناز چون بنده
کوته نکنم ز دامنت دست
ور خود بزنی به تیغ تیزم
بعد از تو ملاذ و ملجائی نیست
هم در تو گریزم ار گریزم
هر کجا سلطان عشق آمد نماند
قوّت بازوی تقوی را محل
پاکدامن چون زید بیچاره‌ای
اوفتاده تا گریبان در وحل
چو در چشم شاهد نیاید زرت
زر و خاک یکسان نماید برت
دوستان گو نصیحتم مکنید
که مرا دیده بر ارادت اوست
جنگجویان به زور پنجه و کتف
دشمنان را کشند و خوبان دوست
تو که در بند خویشتن باشی
عشق باز دروغ زن باشی
گر نشاید به دوست ره بردن
شرط یاری است در طلب مردن
گر دست رسد که آستینش گیرم
ور نه بروم بر آستانش میرم
دردا که طبیب صبر می‌فرماید
وین نفس حریص را شکر می‌باید
آن شنیدی که شاهدی به نهفت
با دل از دست رفته‌ای می‌گفت
تا تو را قدر خویشتن باشد
پیش چشمت چه قدر من باشد؟
آن کس که مرا بکشت باز آمد پیش
مانا که دلش بسوخت بر کشته خویش
اگر خود هفت سبع از بر بخوانی
چو آشفتی الف ب ت ندانی
عجب است با وجودت که وجود من بماند
تو به گفتن اندر آیی و مرا سخن بماند
عجب از کشته نباشد به در خیمه دوست
عجب از زنده که چون جان به در آورد سلیم
نه آنچنان به تو مشغولم ای بهشتی‌روی
که یاد خویشتنم در ضمیر می‌آید
ز دیدنت نتوانم که دیده در بندم
و گر مقابله بینم که تیر می‌آید
چشم بداندیش که برکنده باد
عیب نماید هنرش در نظر
ور هنری داری و هفتاد عیب
دوست نبیند به جز آن یک هنر
سَریٰ طَیفُ مَن یَجلو بِطَلعَتِهِ الدُّجیٰ
شگفت آمد از بختم که این دولت از کجا
چون گرانی به پیش شمع آید
خیزش اندر میان جمع بکش
ور شکر خنده‌ایست شیرین لب
آستینش بگیر و شمع بکش
دیر آمدى اى نگار سرمست
زودت ندهیم دامن از دست
معشوقه که دیر دیر بینند
آخر کم از آن که سیر بینند
اِذا جِئتَنی فی رِفقَةٍ لِتَزورَنی
وَ اِن جِئتَ فی صلحٍ فَأنتَ مُحارِبٍ
به یک نفس که بر آمیخت یار با اغیار
بسی نماند که غیرت وجود من بکشد
به خنده گفت که من شمع جمعم ای سعدی
مرا از آن چه که پروانه خویشتن بکُشد؟
یار دیرینه مرا گو به زبان توبه مده
که مرا توبه به شمشیر نخواهد بودن
رشکم آید که کسی سیر نگه در تو کند
باز گویم نه که کس سیر نخواهد بودن
هر که بی او به سر نشاید برد
گر جفایی کند بباید برد
روزی از دست گفتمش زنهار
چند از آن روز گفتم استغفار
نکند دوست زینهار از دوست
دل نهادم بر آنچه خاطر اوست
گر به لطفم به نزد خود خواند
ور به قهرم براند او داند
آن که نبات عارضش آب حیات می‌خورَد
در شکرش نگه کند هر که نبات می‌خورَد
برو هر چه می‌بایدت پیش گیر
سرِ ما نداری سر ِخویش گیر
شب‌پره گر وصلِ آفتاب نخواهد
رونقِ بازار ِآفتاب نکاهد
فَقَدتُ زَمانَ الوَصلِ و المَرءُ جاهِلٌ
بِقَدرِ لَذیذِ العَیشِ قَبلَ المَصائِبِ
باز آی و مرا بکش که پیشت مردن
خوشتر که پس از تو زندگانی کردن
آن روز که خط شاهدت بود
صاحب‌نظر از نظر براندی
امروز بیامدی به صلحش
کش فتحه و ضمه بر نشاندی
تازه بهارا ورقت زرد شد
دیگ منه کآتش ما سرد شد
چند خرامی و تکبر کنی؟
دولت پارینه تصور کنی
پیش کسی رو که طلبکار توست
ناز بر آن کن که خریدار توست
سبزه در باغ گفته‌اند خوش است
داند آن کس که این سخن گوید
یعنی از روی نیکوان خط سبز
دل عشاق بیشتر جوید
بوستان تو گندنازاریست
بس که بر می‌کنی و می‌روید
گر صبر کنی ور نکنی موی بناگوش
این دولت ایام نکویی به سر آید
گر دست به جان داشتمی همچو تو بر ریش
نگذاشتمی تا به قیامت که بر آید
سؤال کردم و گفتم جمال روی تو را
چه شد که مورچه بر گرد ماه جوشیده‌ست؟
جواب داد ندانم چه بود رویم را
مگر به ماتم حسنم سیاه پوشیده‌ست"
saadi,golestan,"
امرد آن گه که خوب و شیرین است
تلخ گفتار و تندخوی بود
چون به ریش آمد و به لعنت شد
مردم آمیز و مهرجوی بود
و اِن سَلِمَ الإنسانُ مِن سوءِ نَفسِهِ
فَمِن سوءَ ظَنِّ المُدَّعی لَیسَ یَسلَمُ
شاید پس کار خویشتن بنشستن
لیکن نتوان زبان مردم بستن
علی الصباح به روی تو هر که برخیزد
صباح روز سلامت بر او مسا باشد
بد اختری چو تو در صحبت تو بایستی
ولی چنین که تویی در جهان کجا باشد
پارسا را بس این قدر زندان
که بود هم طویلهٔ رندان
کس نیاید به پای دیواری
که بر آن صورتت نگار کنند
گر تو را در بهشت باشد جای
دیگران دوزخ اختیار کنند
زاهدی در سماع رندان بود
زآن میان گفت شاهدی بلخی
گر ملولی ز ما ترش منشین
که تو هم در میان ما تلخی
جمعی چو گل و لاله به هم پیوسته
تو هیزم خشک در میانی رسته
چون باد مخالف و چو سرما ناخوش
چون برف نشسته‌ای و چون یخ بسته
نگار من چو در آید به خنده نمکین
نمک زیاده کند بر جراحت ریشان
چه بودی ار سر زلفش به دستم افتادی
چو آستین کریمان به دست درویشان
نه ما را در میان عهد و وفا بود
جفا کردی و بد عهدی نمودی
به یک بار از جهان دل در تو بستم
ندانستم که برگردی به زودی
هنوزت گر سر صلح است باز آی
کز آن مقبولتر باشی که بودی
گل به تاراج رفت و خار بماند
گنج برداشتند و مار بماند
دیده بر تارک سنان دیدن
خوشتر از روی دشمنان دیدن
واجب است از هزار دوست برید
تا یکی دشمنت نباید دید
ظَمَأٌ بِقَلبی لا یَکادُ یُسیغُهُ
رَشفُ الزُّلالِ وَ لَو شَرِبتُ بُحوراً
خرم آن فرخنده طالع را که چشم
بر چنین روی اوفتد هر بامداد
مست می بیدار گردد نیمشب
مست ساقی روز محشر بامداد
معلمت همه شوخی و دلبری آموخت
جفا و ناز و عتاب و ستمگری آموخت
من آدمی به چنین شکل و خوی و قد و روش
ندیده‌ام مگر این شیوه از پری آموخت
بُلیتُ بِنَحویٍّ یَصولُ مُغاضِباً
عَلَیَّ کَزَیدٍ فی مُقابَلَةِ العَمرو
علی جَرِّ ذَیلٍ لَیسَ یَرفَعُ رَأسَهُ
وَ هَل یَستَقیمُ الَّرفعُ مِن عامِلِ الجَرِّ
طبع تو را تا هوس نحو کرد
صورت صبر از دل ما محو کرد
ای دل عشاق به دام تو صید
ما به تو مشغول و تو با عمرو و زید
بزرگی دیدم اندر کوهساری
قناعت کرده از دنیا به غاری
چرا گفتم به شهر اندر نیایی
که باری بندی از دل برگشایی
بگفت آنجا پریرویان نغزند
چو گل بسیار شد پیلان بلغزند
بوسه دادن به روی دوست چه سود
هم در این لحظه کردنش بدرود
سیب گویی وداع بستان کرد
روی از این نیمه سرخ و زآن سو زرد
اِن لَم اَمُت یَومَ الوَداعِ تَأسُّفاً
لا تَحسَبونی فی المَوَدَّةِ مُنصِفاً
گر تضرع کنی و گر فریاد
دزد زر باز پس نخواهد داد
نباید بستن اندر چیز و کس دل
که دل برداشتن کاریست مشکل
مگر ملائکه بر آسمان وگر نه بشر
به حسن صورت او در زمی نخواهد بود
به دوستی که حرام است بعد از او صحبت
که هیچ نطفه چنو آدمی نخواهد بود
کاش کآن روز که در پای تو شد خار اجل
دست گیتی بزدی تیغ هلاکم بر سر
تا در این روز جهان بی تو ندیدی چشمم
این منم بر سر خاک تو که خاکم بر سر
آن که قرارش نگرفتی و خواب
تا گل و نسرین نفشاندی نخست
گردش گیتی گل رویش بریخت
خاربنان بر سر خاکش برست
سود دریا نیک بودی گر نبودی بیم موج
صحبت گل خوش بدی گر نیستی تشویش خار
دوش چون طاووس می‌نازیدم اندر باغ وصل
دیگر امروز از فراق یار می‌پیچم چو مار
وَ رُبَّ صَدیقٍ لامَنی فی وِدادِها
اَلَم یَرَها یَوماً فَیوضِحَ لی عُذری
کاش کآنان که عیب من جستند
رویت ای دلستان بدیدندی
تا به جای ترنج در نظرت
بی خبر دستها بریدندی
ما مَرَّ مِن ذِکرِ الحِمیٰ بِمَسمَعی
لَو سَمِعَت وُرقُ الحِمی صاحَت مَعی
یا مَعشَرَ الخُلاّنِ قولوا لِلمُعا
فیٰ لَستَ تَدری ما بِقَلبِ الموجَعِ
تندرستان را نباشد درد ریش
جز به همدردی نگویم درد خویش
گفتن از زنبور بی حاصل بود
با یکی در عمر خود ناخورده نیش
تا تو را حالی نباشد همچو ما
حال ما باشد تو را افسانه پیش
سوز من با دیگری نسبت مکن
او نمک بر دست و من بر عضو ریش"
saadi,golestan,"
چون بود اصل گوهری قابل
تربیت را در او اثر باشد
هیچ صیقل نکو نداند کرد
آهنی را که بدگهر باشد
سگ به دریای هفتگانه بشوی
که چو تر شد پلیدتر باشد
خر عیسی گرش به مکه برند
چون بیاید هنوز خر باشد
سخت است پس از جاه تحکم بردن
خو کرده به ناز جور مردم بردن
وقتی افتاد فتنه‌ای در شام
هر کس از گوشه‌ای فرا رفتند
روستازادگان دانشمند
به وزیری پادشا رفتند
پسران وزیر ناقص عقل
به گدایی به روستا رفتند
اگر صد ناپسند آید ز درویش
رفیقانش یکی از صد ندانند
وگر یک بذله گوید پادشاهی
از اقلیمی به اقلیمی رسانند
هر که در خردیش ادب نکنند
در بزرگی فلاح از او برخاست
چوب تر را چنان که خواهی پیچ
نشود خشک جز به آتش راست
استاد معلم چو بود بی آزار
خرسک بازند کودکان در بازار
پادشاهی پسر به مکتب داد
لوح سیمینش بر کنار نهاد
بر سر لوح او نبشته به زر
جور استاد به ز مهر پدر
چو دخلت نیست خرج آهسته تر کن
که می‌گویند ملاحان سرودی
اگر باران به کوهستان نبارد
به سالی دجله گردد خشک رودی
خداوندان کام و نیکبختی
چرا سختی خورند از بیم سختی
برو شادی کن ای یار دل افروز
غم فردا نشاید خورد امروز
هر که علم شد به سخا و کرم
بند نشاید که نهد بر درم
نام نکویی چو برون شد به کوی
در نتوانی که ببندی به روی
گرچه دانی که نشنوند بگوی
هر چه دانی ز نیکخواهی و پند
زود باشد که خیره سر بینی
به دو پای اوفتاده اندر بند
دست بر دست می زند که دریغ
نشنیدم حدیث دانشمند
حریف سفله در پایان مستی
نیندیشد ز روز تنگدستی
درخت اندر بهاران بر فشاند
زمستان لاجرم بی برگ ماند
گرچه سیم و زر ز سنگ آید همی
در همه سنگی نباشد زر و سیم
بر همه عالم همی‌تابد سهیل
جایی انبان میکند جایی ادیم
فراموشت نکرد ایزد در آن حال
که بودی نطفهٔ مدفون و مدهوش
روانت داد و طبع و عقل و ادراک
جمال و نطق و رای و فکرت و هوش
ده انگشتت مرتب کرد بر کف
دو بازویت مرکب ساخت بر دوش
کنون پنداری ای ناچیز همت‌!
که خواهد کردنت روزی فراموش‌؟
جامه کعبه را که می بوسند
او نه از کرم پیله نامی شد
با عزیزی نشست روزی چند
لاجرم همچنو گرامی شد
پسری را پدر وصیت کرد
کای جوانبخت یاد گیر این پند
هر که با اهل خود وفا نکند
نشود دوست روی و دولتمند
زنان باردار ای مرد هشیار
اگر وقت ولادت مار زایند
از آن بهتر به نزدیک خردمند
که فرزندان ناهموار زایند
به صورت آدمی شد قطرهٔ آب
که چل روزش قرار اندر رحم ماند
و گر چل ساله را عقل و ادب نیست
به تحقیقش نشاید آدمی خواند
جوانمردی و لطف است آدمیت
همین نقش هیولانی مپندار
هنر باید که صورت می توان کرد
به ایوان‌ها در از شنگرف و زنگار
چو انسان را نباشد فضل و احسان
چه فرق از آدمی تا نقش دیوار
به دست آوردن دنیا هنر نیست
یکی را گر توانی دل به دست آر
از من بگوی حاجی مردم گزای را
کاو پوستین خلق به آزار می‌درد
حاجی تو نیستی شتر است از برای آنک
بیچاره خار می‌خورد و بار می‌برد
تا ندانی که سخن عین صواب است مگوی
وآنچه دانی که نه نیکوش جواب است مگوی
ندهد هوشمند روشن رای
به فرومایه کارهای خطیر
بوریاباف اگر چه بافنده‌ست
نبرندش به کارگاه حریر
وه که هر گه که سبزه در بستان
بدمیدی چه خوش شدی دل من
بگذر ای دوست تا به وقت بهار
سبزه بینی دمیده بر گل من
بر بنده مگیر خشم بسیار
جورش مکن و دلش میازار
او را تو به ده درم خریدی
آخر نه به قدرت آفریدی
این حکم و غرور و خشم تا چند
هست از تو بزرگتر خداوند
ای خواجهٔ ارسلان و آغوش
فرمانده خود مکن فراموش
بر غلامی که طوع خدمت توست
خشم بی حد مران و طیره مگیر
که فضیحت بود به روز شمار
بنده آزاد و خواجه در زنجیر
نیفتاده بر دست دشمن اسیر
به گِردش نباریده باران تیر
پیل کو تا کتف و بازوی گُردان بیند؟
شیر کو تا کف و سر پنجهٔ مردان بیند؟
بیار آنچه داری ز مردی و زور
که دشمن به پای خود آمد به گور
نه هر که موی شکافد به تیر جوشن‌خای
به روز حملهٔ جنگاوران بدارد پای
به کارهای گران مرد کاردیده فرست
که شیر شرزه در آرد به زیر خمّ کمند
جوان اگر چه قوی‌یال و پیلتن باشد
به جنگ دشمنش از هول بگسلد پیوند
نبرد پیش مصاف‌آزموده معلوم است
چنان که مسألهٔ شرع پیش دانشمند"
saadi,golestan,"
مکن نماز بر آن هیچکس که هیچ نکرد
که عمر در سرِ تحصیلِ مال کرد و نخورد
آن کس که به دینار و درم خیر نیندوخت
سر عاقبت اندر سر دینار و درم کرد
خواهی که ممتّع شوی از دنیی و عقبی
با خلق کرم کن چو خدا با تو کرم کرد
درخت کرَم هر کجا بیخ کرد
گذشت از فلک شاخ و بالای او
گر امّیدواری کز او بر خوری
به منّت منه ارّه بر پای او
شکر خدای کن که موفق شدی به خیر
ز انعام و فضل او، نه معطّل گذاشتت
منّت منه که خدمت سلطان کنی همی
منّت شناس از او که به خدمت بداشتت
علم چندان که بیشتر خوانی
چون عمل در تو نیست نادانی
نه محقق بود نه دانشمند
چارپایی بر او کتابی چند
آن تهی مغز را چه علم و خبر
که بر او هیزم است یا دفتر
هر که پرهیز و علم و زهد فروخت
خرمنی گرد کرد و پاک بسوخت
بی فایده هر که عمر در باخت
چیزی نخرید و زر بینداخت
پندی اگر بشنوی ای پادشاه
در همه عالم به از این پند نیست
جز به خردمند مفرما عمل
گرچه عمل کار خردمند نیست

خبیث را چو تعهد کنی و بنوازی
به دولت تو گنه می‌کند به انبازی
معشوق هزار دوست را دل ندهی
ور می‌دهی آن دل به جدایی بنهی
خامشی به که ضمیر دل خویش
با کسی گفتن و گفتن که مگوی
ای سلیم آب ز سرچشمه ببند
که چو پر شد نتوان بستن جوی
سخنی در نهان نباید گفت
که بر انجمن نشاید گفت
امروز بکش چو می‌توان کشت
کآتش چو بلند شد جهان سوخت
مگذار که زه کند کمان را
دشمن که به تیر می‌توان دوخت
میان دو کس جنگ چون آتش است
سخن چین بدبخت هیزم کش است
کنند این و آن خوش دگرباره دل
وی اندر میان کوربخت و خجل
میان دو تن آتش افروختن
نه عقل است و خود در میان سوختن
در سخن با دوستان آهسته باش
تا ندارد دشمن خونخوار گوش
پیش دیوار آنچه گویی هوش دار
تا نباشد در پس دیوار گوش
بشوی ای خردمند از آن دوست دست
که با دشمنانت بود هم نشست
با مردم سهل خوی دشخوار مگوی
با آن که در صلح زند جنگ مجوی
چو دست از همه حیلتی در گسست
حلال است بردن به شمشیر دست
دشمن چو بینی ناتوان لاف از بروت خود مزن
مغزیست در هر استخوان مردیست در هر پیرهن
پسندیده‌ست بخشایش ولیکن
منه بر ریش خلق‌آزار مرهم
ندانست آن که رحمت کرد بر مار
که آن ظلم است بر فرزند آدم
حذر کن زآنچه دشمن گوید آن کن
که بر زانو زنی دست تغابن
گرت راهی نماید راست چون تیر
از او برگرد و راه دست چپ گیر
درشتی و نرمی به هم در به است
چو فاصد که جراح و مرهم نه است
درشتی نه گیرد خردمند پیش
نه سستی که ناقص کند قدر خویش
نه مر خویشتن را فزونی نهد
نه یکباره تن در مذلت دهد
شبانی با پدر گفت: ای خردمند
مرا تعلیم ده پیرانه یک پند
بگفتا: نیکمردی کن نه چندان
که گردد خیره گرگ تیز دندان
بر سر ملک مباد آن ملک فرمانده
که خدا را نبود بندهٔ فرمانبردار
نشاید بنی‌آدم خاکزاد
که در سر کند کبر و تندی و باد
تو را با چنین گرمی و سرکشی
نپندارم از خاکی از آتشی
در خاک بیلقان برسیدم به عابدی
گفتم: مرا به تربیت از جهل پاک کن
گفتا: برو چو خاک تحمل کن ای فقیه
یا هر چه خوانده‌ای همه در زیر خاک کن
اگر ز دست بلا بر فلک رود بدخوی
ز دست خوی بد خویش در بلا باشد
برو با دوستان آسوده بنشین
چو بینی در میان دشمنان جنگ
وگر بینی که با هم یکزبانند
کمان را زه کن و بر باره بر سنگ

به روز ِ معرکه ایمِن مشو ز خصم ِ ضعیف
که مغز ِ شیر برآرد چو دل ز جان برداشت
بلبلا! مژدهٔ بهار بیار
خبر ِ بد به بوم باز گذار
بسیج ِ سخن گفتن آنگاه کن
که دانی که در کار گیرد سخُن

الا تا نشنوی مدح سخنگوی
که اندک مایه نفعی از تو دارد
که گر روزی مرادش بر نیاری
دو صد چندان عیوبت بر شمارد
مشو غرّه بر حُسن ِ گفتار ِ خویش
به تحسین نادان و پندار خویش"
