author,book,text
saadi,golestan,"
وقت ضرورت چو نماند گریز
دست بگیرد سر شمشیر تیز
إِذا یَئِسَ الْإِنسانُ طالَ لِسانُهُ
کَسِنَّورٍ مغلوبٍ یَصولُ عَلَی الْکلبِ
هر که شاه آن کند که او گوید
حیف باشد که جز نکو گوید
جهان ای برادر نمانَد به کس
دل اندر جهان‌آفرین بند و بس
مکن تکیه بر مُلْک دنیا و پشت
که بسیار کس چون تو پرورد و کُشت
چو آهنگ رفتن کند جان پاک
چه بر تخت مردن چه بر روی خاک
بس نامور به زیر زمین دفن کرده‌اند 
کز هستیش به روی زمین بر نشان نماند
وآن پیر لاشه را که سپردند زیر گل 
خاکش چنان بخورد کزو استخوان نماند
زنده‌ست نام فرّخ نوشیروان به خیر 
گرچه بسی گذشت که نوشیروان نماند
خیری کن ای فلان و غنیمت شمار عمر 
زآن پیشتر که بانگ بر آید: فلان نماند
اقلُّ جِبالِ الارضِ طورٌ و اِنّهُ
لاَعظَمُ عندَ اللهِ قدراً وَ منزلا
آن شنیدی که لاغری دانا
گفت باری به ابلهی فربه
اسب تازی و گر ضعیف بود
همچنان از طویله‌ای خر به
تا مرد سخن نگفته باشد
عیب و هنرش نهفته باشد
هر پیسه گمان مبر نهالی
باشد که پلنگ خفته باشد
آن نه من باشم که روز جنگ بینی پشت من
آن منم گر در میان خاک و خون بینی سری
کانکه جنگ آرد به خون خویش بازی می‌کند
روز میدان و آن که بگریزد به خون لشکری
ای که شخص منت حقیر نمود
تا درشتی هنر نپنداری
اسب لاغرمیان به کار آید
روز میدان نه گاو پرواری
کس نیاید به زیر سایه بوم
ور همای از جهان شود معدوم
نیم‌نانی گر خورد مرد خدا
بذل درویشان کند نیمی دگر
ملک اقلیمی بگیرد پادشاه
همچنان در بند اقلیمی دگر
درختی که اکنون گرفته‌ست پای 
به نیروی شخصی برآید ز جای
و گر همچنان روزگاری هلی 
به گردونش از بیخ بر نگسلی
سر چشمه شاید گرفتن به بیل 
چو پر شد نشاید گذشتن به پیل
قرص خورشید در سیاهی شد 
یونس اندر دهان ماهی شد
پرتو نیکان نگیرد هر که بنیادش بد است 
تربیت نااهل را چون گردکان بر گنبد است
ابر اگر آب زندگی بارد 
هرگز از شاخ بید بر نخوری
با فرومایه روزگار مبر 
کز نی بوریا شکر نخوری
با بدان یار گشت همسر لوط 
خاندان نبوّتش گم شد
سگ اصحاب کهف روزی چند 
پی نیکان گرفت و مردم شد
دانی که چه گفت زال با رستم گرد؟
دشمن نتوان حقیر و بیچاره شمرد
دیدیم بسی که آب سرچشمه خرد 
چون بیشتر آمد شتر و بار ببرد
عاقبت گرگ‌زاده گرگ شود 
گرچه با آدمی بزرگ شود
شمشیر نیک از آهن بد چون کند کسی؟
ناکس به تربیت نشود ای حکیم کس
باران که در لطافت طبعش خلاف نیست 
در باغ لاله روید و در شوره بوم خس
زمین شوره سنبل بر نیارد 
در او تخم و عمل ضایع مگردان
نکویی با بدان کردن چنان است 
که بد کردن به جای نیک‌مردان
بالای سرش ز هوشمندی 
می‌تافت ستاره بلندی
توانم آنکه نیازارم اندرون کسی
حسود را چه کنم کاو ز خود به رنج در است؟
بمیر تا برهی ای حسود کاین رنجی‌ست
که از مشقت آن جز به مرگ نتوان رست
شوربختان به آرزو خواهند 
مقبلان را زوال نعمت و جاه
گر نبیند به روز شپّره چشم 
چشمه آفتاب را چه گناه
راست خواهی هزار چشم چنان 
کور بهتر که آفتاب سیاه
هر که فریاد‌رس روز مصیبت خواهد 
گو در ایام سلامت به جوانمردی کوش
بنده حلقه به گوش ار ننوازی برود 
لطف کن لطف که بیگانه شود حلقه به گوش
همان به که لشکر به جان پروری 
که سلطان به لشکر کند سروری
نکند جور پیشه سلطانی 
که نیاید ز گرگ چوپانی
پادشاهی که طرح ظلم افکند 
پای دیوار ملک خویش بکند
پادشاهی کاو روا دارد ستم بر زیردست 
دوستدارش روز سختی دشمن زورآورست
با رعیت صلح کن وز جنگ خصم ایمن نشین 
زان که شاهنشاه عادل را رعیت لشکرست
ای سیر تو را نان جوین خوش ننماید 
معشوق من است آن که به نزدیک تو زشت است
حوران بهشتی را دوزخ بود اعراف 
از دوزخیان پرس که اعراف بهشت است
فرق است میان آن که یارش در بر 
تا آن که دو چشم انتظارش بر در
از آن کز تو ترسد بترس ای حکیم
وگر با چنو صد بر آیی به جنگ
از آن مار بر پای راعی زند
که ترسد سرش را بکوبد به سنگ
نبینی که چون گربه عاجز شود
برآرد به چنگال چشم پلنگ"
saadi,golestan,"
بدین امید به سر شد دریغ عمر عزیز 
که آنچه در دلم است از درم فراز آید
امید بسته بر آمد ولی چه فایده زانک 
امید نیست که عمر گذشته باز آید
کوس رحلت بکوفت دست اجل 
ای دو چشمم وداع سر بکنید
ای کف دست و ساعد و بازو 
همه تودیع یکدگر بکنید
بر منِ اوفتاده دشمن کام 
آخر ای دوستان گذر بکنید
روزگارم بشد بنادانی 
من نکردم شما حذر بکنید
درویش و غنی بنده این خاک درند
و آنان که غنی ترند محتاج ترند
به بازوان توانا و قوت سر دست
خطاست پنجه مسکین ناتوان بشکست
نترسد آن که بر افتادگان نبخشاید
که گر ز پای در آید کسش نگیرد دست
هر آن که تخم بدی کشت و چشم نیکی داشت
دماغ بیهده پخت و خیال باطل بست
ز گوش پنبه برون آر و داد خلق بده
وگر تو می‌ندهی داد روز دادی هست
بنی آدم اعضای یکدیگرند
که در آفرینش ز یک گوهرند
چو عضوی به درد آورد روزگار
دگر عضوها را نماند قرار
تو کز محنت دیگران بی غمی
نشاید که نامت نهند آدمی
ای زبردست زیردست آزار 
گرم تا کی بماند این بازار
به چه کار آیدت جهانداری 
مردنت به که مردم آزاری
ظالمی را خفته دیدم نیم‌روز
گفتم این فتنه است خوابش برده بِه
وآنکه خوابش بهتر از بیداری است
آن‌چنان بد زندگانی مرده به
ما را به جهان خوش تر از این یک دم نیست 
کز نیک و بد اندیشه و از کس غم نیست
ای آنکه به اقبال تو در عالم نیست 
گیرم که غمت نیست، غم ما هم نیست
قرار بر کف آزادگان نگیرد مال 
نه صبر در دل عاشق نه آب در غربال
حرامش بود نعمت پادشاه 
که هنگام فرصت ندارد نگاه
مجال سخن تا نبینی ز پیش 
به بیهوده گفتن مبر قدر خویش
ابلهی کو روز روشن شمع کافوری نهد 
زود بینی کش به شب روغن نباشد در چراغ
به روی خود در طماع باز نتوان کرد 
چو باز شد به درشتی فراز نتوان کرد
کس نبیند که تشنگان حجاز 
به سر آب شور گرد آیند
هر کجا چشمه ای بود شیرین 
مردم و مرغ و مور گرد آیند
چو دارند گنج از سپاهی دریغ 
دریغ آیدش دست بردن به تیغ
زر بده مرد سپاهی را تا سر بنهد 
و گرش زر ندهی سر بنهد در عالم
اذا شبعَ الکمیُّ یَصولُ بَطشاً 
وَ خاوی البطنِ یَبْطِشُ بِالفَرارِ
آنان که به کنج عافیت بنشستند 
دندان سگ و دهان مردم بستند
کاغذ بدریدند و قلم بشکستند 
وز دست زبان حرف‌گیران رستند
همای بر همه مرغان از آن شرف دارد 
که استخوان خورد و جانور نیازارد
اگر صد سال گبر آتش فروزد 
اگر یک دم در او افتد بسوزد
تو بر سر قدر خویشتن باش و وقار 
بازی و ظرافت به ندیمان بگذار
بس گرسنه خفت و کس ندانست که کیست 
بس جان به لب آمد که بر او کس نگریست
مبین آن بی حمیّت را که هرگز 
نخواهد دید روی نیکبختی
که آسانی گزیند خویشتن را 
زن و فرزند بگذارد به سختی
کس نیاید به خانه درویش 
که خراج زمین و باغ بده
یا به تشویش و غصه راضی باش 
یا جگربند پیش زاغ بنه
راستی موجب رضای خداست 
کس ندیدم که گم شد از ره راست
مکن فراخ روی در عمل اگر خواهی 
که وقت رفع تو باشد مجال دشمن تنگ
تو پاک باش و مدار از کس ای برادر باک 
زنند جامه ناپاک گازران بر سنگ
به دریا در منافع بی‌شمار است 
و گر خواهی سلامت، بر کنار است
دوست مشمار آن که در نعمت زند 
لاف یاری و برادر خواندگی
دوست آن دانم که گیرد دست دوست 
در پریشان حالی و درماندگی
ز کار بسته میندیش و دل شکسته مدار 
که آب چشمه حیوان درون تاریکی است
الا لا یجأرَنَّ اخو البلیّة 
فللرّحمنِ الطافٌ خَفیّه
منشین ترش از گردش ایام که صبر 
تلخ است ولیکن بر شیرین دارد
نبینی که پیش خداوند جاه 
نیایش‌کنان دست بر بر نهند
اگر روزگارش در آرد ز پای 
همه عالمش پای بر سر نهند
یا زر به هر دو دست کند خواجه در کنار 
یا موج روزی افکندش مرده بر کنار
ندانستی که بینی بند بر پای 
چو در گوشت نیامد پند مردم
دگر ره چون نداری طاقت نیش 
مکن انگشت در سوراخ کژدم
در میر و وزیر و سلطان را 
بی وسیلت مگرد پیرامن
سگ و دربان چو یافتند غریب 
این گریبانش گیرد آن دامن
بگذار که بندهٔ کمینم
تا در صف بندگان نشینم
گر بر سر و چشم ما نشینی 
بارت بکشم که نازنینی
چه جرم دید خداوند سابق الانعام 
که بنده در نظر خویش خوار می‌دارد
خدای راست مسلم بزرگواری و حکم 
که جرم بیند و نان برقرار می‌دارد
چو کعبه قبله حاجت شد از دیار بعید 
روند خلق به دیدارش از بسی فرسنگ
تو را تحمل امثال ما بباید کرد 
که هیچ کس نزند بر درخت بی بر، سنگ"
saadi,golestan,"
نیاساید مشام از طبله عود 
بر آتش نه که چون عنبر ببوید
بزرگی بایدت بخشندگی کن 
که دانه تا نیفشانی نروید
اگر گنجی کنی بر عامیان بخش 
رسد هر کدخدایی را برنجی
چرا نستانی از هر یک جوی سیم 
که گرد آید تو را هر وقت گنجی
قارون هلاک شد که چهل خانه گنج داشت 
نوشیروان نمرد که نام نکو گذاشت
اگر ز باغ رعیّت مَلِک خورد سیبی 
بر آورند غلامان او درخت از بیخ
به پنج بیضه که سلطان ستم روا دارد 
زنند لشکریانش هزار مرغ به سیخ
آتشِ سوزان نکند با سپند 
آنچه کند دود دل دردمند
مسکین‌خر ار چه بی‌تمیز است 
چون بار همی‌برد عزیز است
گاوان و خران باربردار 
بِهْ ز آدمیان مردم‌آزار
حاصل نشود رضای سلطان 
تا خاطر بندگان نجویی
خواهی که خدای بر تو بخشد؟ 
با خلق خدای کن نکویی
نه هرکه قوّتِ بازویِ منصبی دارد 
به سلطنت بخورد مال مردمان به گزاف
توان به حلق فرو بردن استخوان درشت 
ولی شکم بدرد چون بگیرد اندر ناف
نمانَد ستم‌کار بدروزگار 
بماند بر او لعنتِ پایدار
ناسزایی را که بینی بخت یار 
عاقلان تسلیم کردند اختیار
چون نداری ناخن درنده تیز 
با ددان آن به که کم گیری ستیز
هر که با پولاد بازو پنجه کرد 
ساعد سیمین خود را رنجه کرد
باش تا دستش ببندد روزگار 
پس به کام دوستان مغزش بر آر
پیش که بر آورم ز دستت فریاد 
هم پیش تو از دست تو گر خواهم داد
همچنان در فکر آن بیتم که گفت 
پیلبانی بر لب دریای نیل
زیر پایت گر بدانی حال مور 
همچو حال توست زیر پای پیل
هر چه رود بر سرم چون تو پسندی رواست 
بنده چه دعوی کند حکم خداوند راست
چو کردی با کلوخ انداز پیکار 
سر خود را به نادانی شکستی
چو تیر انداختی بر روی دشمن 
چنین دان کاندر آماجش نشستی
صلح با دشمن اگر خواهی هر گه که تو را 
در قفا عیب کند در نظرش تحسین کن
سخن آخر به دهان می‌گذرد موذی را 
سخنش تلخ نخواهی دهنش شیرین کن
آن را که به جای توست هر دم کرمی
عذرش بنه ار کند به عمری ستمی
گر گزندت رسد ز خلق مرنج 
که نه راحت رسد ز خلق نه رنج
از خدا دان خلاف دشمن و دوست 
کاین دل هر دو در تصرف اوست
گرچه تیر از کمان همی‌ گذرد 
از کمان دار بیند اهل خرد
دو بامداد اگر آید کسی به خدمت شاه
سیم، هر آینه در وی کند به لطف نگاه
مهتری در قبول فرمان است 
ترک فرمان دلیل حرمان است
هر که سیمای راستان دارد
سر خدمت بر آستان دارد
ماری تو که هر که را ببینی بزنی
یا بوم که هر کجا نشینی بکنی
زورت ار پیش می‌رود با ما 
با خداوند غیب دان نرود
زورمندی مکن بر اهل زمین
تا دعایی بر آسمان نرود
حذر کن ز دود درونهای ریش
که ریش درون عاقبت سر کند
به هم بر مکن تا توانی دلی 
که آهی جهانی به هم بر کند
چه سالهای فراوان و عمر‌های دراز 
که خلق بر سر ما بر زمین بخواهد رفت
چنان که دست به دست آمده‌ست ملک به ما
به دستهای دگر همچنین بخواهد رفت
یا وفا خود نبود در عالم
یا مگر کس در این زمانه نکرد
کس نیاموخت علم تیر از من 
که مرا عاقبت نشانه نکرد
پادشه پاسبان درویش است
گرچه رامش به فرّ دولت اوست
گوسپند از برای چوپان نیست
بلکه چوپان برای خدمت اوست
یکی امروز کامران بینی 
دیگری را دل از مجاهده ریش
روزکی چند باش تا بخورد
خاک، مغز سر خیال اندیش
فرق شاهی و بندگی برخاست 
چون قضای نبشته آمد پیش
گر کسی خاک مرده باز کند
ننماید توانگر و درویش
دریاب کنون که نعمتت هست به دست 
کاین دولت و ملک می‌رود دست به دست
گر نه امید و بیم راحت و رنج
پای درویش بر فلک بودی
ور وزیر از خدا بترسیدی 
همچنان کز ملک، ملک بودی
دوران بقا چو باد صحرا بگذشت
تلخی و خوشی و زشت و زیبا بگذشت
پنداشت ستمگر که جفا بر ما کرد 
در گردن او بماند و بر ما بگذشت
خلاف رای سلطان رای جستن
به خون خویش باشد دست شستن
اگر خود روز را گوید شب است این
بباید گفتن آنک ماه و پروین!
غریبی گرت ماست پیش آورد
دو پیمانه آب است و یک چمچه دوغ
اگر راست می‌خواهی از من شنو
جهان‌دیده بسیار گوید دروغ"
saadi,golestan,"
هر که را جامه پارسا بینی
پارسا دان و نیکمرد انگار
ور ندانی که در نهانش چیست
محتسب را درون خانه چه کار
عذر تقصیر خدمت آوردم 
که ندارم به طاعت استظهار
عاصیان از گناه توبه کنند 
عارفان از عبادت استغفار
بر در کعبه سائلی دیدم
که همی‌گفت و می‌گرستی خوش
می‌نگویم که طاعتم بپذیر 
قلم عفو بر گناهم کش
روی بر خاک عجز می‌گویم
هر سحرگه که باد می‌آید
ای که هرگز فرامشت نکنم 
هیچت از بنده یاد می‌آید؟
شنیدم که مردان راه خدای
دل دشمنان را نکردند تنگ
تو را کی میسر شود این مقام 
که با دوستانت خلاف است و جنگ
در برابر چو گوسپند سلیم 
در قفا همچو گرگ مردم خوار
هر که عیب دگران پیش تو آورد و شمرد
بی‌گمان عیب تو پیش دگران خواهد برد
اِنْ لمْ اَکُن راکِب المواشی
اَسعی لَکم حامِلَ الغواشی
چه دانند مردم که در خانه کیست 
نویسنده داند که در نامه چیست
صورت حال عارفان دلق است 
این قدر بس چو روی در خلق است
در عمل کوش و هرچه خواهی پوش
تاج بر سر نه و عَلَم بر دوش
ترک دنیا و شهوت است و هوس
پارسایی، نه ترک جامه و بس
در قژاکند مرد باید بود 
بر مخنث سلاح جنگ چه سود؟
پارسا بین که خرقه در بر کرد
جامه کعبه را جل خر کرد
چو از قومی یکی بی‌دانشی کرد
نه کِه را منزلت مانَد نه مِه را
شنیدستی که گاوی در علف‌خوار 
بیالاید همه گاوان ده را
به یک ناتراشیده در مجلسی 
برنجد دل هوشمندان بسی
اگر برکه‌ای پر کنند از گلاب 
سگی در وی افتد کند منجلاب
ترسم نرسی به کعبه، ای اعرابی 
کاین ره که تو می‌روی به ترکستان است
ای هنرها گرفته بر کف دست
 عیبها بر گرفته زیر بغل
تا چه خواهی خریدن ای مغرور
روز درماندگی به سیم دغل
نبیند مدعی جز خویشتن را 
که دارد پرده پندار در پیش
گرت چشم خدا بینی ببخشند 
نبینی هیچ کس عاجزتر از خویش
کُفَیتَ اَذیً یا مَن یَعُدُّ مَحاسنی
علانیَتی هذا ولم تدرِ ما بَطَنَ
شخصم به چشم عالمیان خوب منظر است
وز خبث باطنم سر خجلت فتاده پیش
طاووس را به نقش و نگاری که هست خلق 
تحسین کنند و او خجل از پای زشت خویش
دیدار می‌نمایی و پرهیز می‌کنی
بازار خویش و آتش ما تیز می‌کنی
اُشاهِدُ مَنْ اَهوی بِغَیْر وَسیلةٍ 
فَیَلْحَقُنی شَأنٌ اَضلُّ طَریقاً
یکی پرسید از آن گم‌کرده‌فرزند
که ای روشن‌گُهر پیر خردمند
ز مصرش بوی پیراهن شنیدی
چرا در چاه کنعانش ندیدی؟!
بگفت: احوال ما برق جهان است
دمی پیدا و دیگر دم نهان است
گهی بر طارم اعلی نشینیم
گهی بر پشت پای خود نبینیم
اگر درویش در حالی بماندی
سر دست از دو عالم برفشاندی
دوست نزدیکتر از من به من است
وینت مشکل که من از وی دورم
چه کنم با که توان گفت که او 
در کنار من و من مهجورم
فهم سخن چون نکند مستمع
قوت طبع از متکلم مجوی
فسحت میدان ارادت بیار 
تا بزند مرد سخنگوی گوی
پای مسکین پیاده چند رود 
کز تحمل ستوه شد بُختی
تا شود جسم فربهی لاغر 
لاغری مرده باشد از سختی
خوش است زیر مغیلان به راه بادیه خفت 
شب رحیل ولی ترک جان بباید گفت
گر مرا زار به کشتن دهد آن یار عزیز 
تا نگویی که در آن دم غم جانم باشد
گویم از بنده مسکین چه گنه صادر شد 
کاو دل آزرده شد از من غم آنم باشد
چون به سختی در بمانی تن به عجز اندر مده
دشمنان را پوست بر کن دوستان را پوستین
هر سو دود آن کش ز بر خویش براند 
وآن را که بخواند به در کس ندواند
دلقت به چه کار آید و مسحی و مرقع 
خود را ز عمل‌های نکوهیده بری دار
حاجت به کلاه برکی داشتنت نیست 
درویش صفت باش و کلاه تتری دار
« نه به استر بر سوارم نه چو اشتر زیر بارم 
نه خداوند رعیت نه غلام شهریارم
غم موجود و پریشانی معدوم ندارم
نفسی می‌زنم آسوده و عمری می‌گذارم »
شخصی همه شب بر سر بیمار گریست 
چون روز آمد بمرد و بیمار بزیست
ای بسا اسب تیزرو که بماند 
که خر لنگ جان به منزل برد
بس که در خاک تندرستان را 
دفن کردیم و زخم خورده نمرد
آن که چون پسته دیدمش همه مغز 
پوست بر پوست بود همچو پیاز
پارسایان روی در مخلوق 
پشت بر قبله می‌کنند نماز
چون بنده خدای خویش خواند 
باید که به جز خدا نداند"
