author,book,text
saadi,boostan,"
کریم السجایا جمیل الشیم
نبی البرایا شفیع الامم
امام رسل، پیشوای سبیل
امین خدا، مهبط جبرئیل
شفیع الوری، خواجهٔ بعث و نشر
امام الهدی، صدر دیوان حشر
کلیمی که چرخ فلک طور اوست
همه نورها پرتو نور اوست
شفیع مطاع نبی کریم
قسیم جسیم نسیم وسیم
یتیمی که ناکرده قرآن درست
کتب‌خانهٔ چند ملت بشست
چو عزمش برآهخت شمشیر بیم
به معجز میان قمر زد دو نیم
چو صیتش در افواه دنیا فتاد
تزلزل در ایوان کسری فتاد
به لا قامت لات بشکست خرد
به اعزاز دین آب عزی ببرد
نه از لات و عزی برآورد گرد
که تورات و انجیل منسوخ کرد
شبی بر نشست از فلک برگذشت
به تمکین و جاه از ملک درگذشت
چنان گرم در تیه قربت براند
که بر سدره جبریل از او بازماند
بدو گفت سالار بیت‌الحرام
که ای حامل وحی برتر خرام
چو در دوستی مخلصم یافتی
عنانم ز صحبت چرا تافتی؟
بگفتا فراتر مجالم نماند
بماندم که نیروی بالم نماند
اگر یک سر موی برتر پرم
فروغ تجلی بسوزد پرم
نماند به عصیان کسی در گرو
که دارد چنین سیدی پیشرو
چه نعت پسندیده گویم تو را؟
علیک السلام ای نبی الوری
درود ملک بر روان تو باد
بر اصحاب و بر پیروان تو باد
نخستین ابوبکر پیر مرید
عمر، پنجه بر پیچ دیو مرید
خردمند عثمان شب زنده‌دار
چهارم علی، شاه دلدل سوار
خدایا به حق بنی فاطمه
که بر قولم ایمان کنم خاتمه
اگر دعوتم رد کنی ور قبول
من و دست و دامان آل رسول
چه کم گردد ای صدر فرخنده پی
ز قدر رفیعت به درگاه حی
که باشند مشتی گدایان خیل
به مهمان دارالسلامت طفیل
خدایت ثنا گفت و تبجیل کرد
زمین بوس قدر تو جبریل کرد
بلند آسمان پیش قَدْرَت خجل
تو مخلوق و آدم هنوز آب و گل
تو اصل وجود آمدی از نخست
دگر هرچه موجود شد فرع توست
ندانم کدامین سخن گویمت
که والاتری زانچه من گویمت
تو را عز لولاک تمکین بس است
ثنای تو طه و یس بس است
چه وصفت کند سعدی ناتمام؟
علیک الصلوة ای نبی السلام
در اقصای عالم بگشتم بسی
به سر بردم ایام با هر کسی
تمتع به هر گوشه‌ای یافتم
ز هر خرمنی خوشه‌ای یافتم
چو پاکان شیراز، خاکی‌نهاد
ندیدم، که رحمت بر این خاک باد
تولای مردان این پاک‌بوم
برانگیختم خاطر از شام و روم
دریغ آمدم زآن همه بوستان
تهیدست رفتن سوی دوستان
به دل گفتم از مصر قند آورند
برِ دوستان ارمغانی برند
مرا گر تهی بود از آن قند، دست
سخن‌های شیرین‌تر از قند هست
نه قندی که مردم به صورت خورند
که ارباب معنی به کاغذ برند
چو این کاخ دولت بپرداختم
بر او دَه در از تربیت ساختم
یکی باب عدل است و تدبیر و رای
نگهبانی خلق و ترس خدای
دُوُمْ باب احسان نهادم اساس
که مُنعم کند فضل حق را سپاس
سوم باب عشق است و مستی و شور
نه عشقی که بندند بر خود بزور
چهارم تواضع، رضا پنجمین
ششم ذکر مرد قناعت‌گزین
به هفتم در، از عالم تربیت
به هشتم در، از شُکر بر عافیت
نهم بابِ توبه است و راهِ صواب
دهم در مناجات و ختم کتاب
به روز همایون و سال سعید
به تاریخ فرّخ میان دو عید
ز ششصد فزون بود پنجاه و پنج
که پُر دُر شد این نامبردار گنج
بمانده‌ست با دامنی گوهرم
هنوز از خجالت به زانو سرم
که در بحرِ لؤلؤ صدف نیز هست
درختِ بلند است در باغ و پست
الا ای خردمند پاکیزه‌خوی
خردمند نشنیده‌ام عیب‌جوی
قبا گر حریر است و گر پرنیان
به ناچار حَشوَش بود در میان
تو گر پرنیانی نیابی، مجوش
کرم کار فرما و حشوش بپوش
ننازم به سرمایهٔ فضلِ خویش
به دریوزه آورده‌امْ دستْ پیش
شنیدم که در روز امیّد و بیم
بَدان را به نیکان ببخشد کریم
تو نیز اَر بدی بینیم در سَخُن
به خلق جهان‌آفرین کار کن
چو بیتی پسند آیدت از هزار
به مردی، که دست از تَعنَّت بدار
همانا که در فارس انشای من
چو مشک است بی‌قیمت اندر خُتن
چو بانگ دهل هولم از دور بود
به غیبت درم عیبْ مستور بود
گل آورد سعدیْ سوی بوستان
به شوخی و فلفل به هندوستان
چو خرما به شیرینی اندوده پوست
چو بازش کنی استخوانی در اوست
مرا طبع از این نوع خواهان نبود
سر مدحت پادشاهان نبود
ولی نظم کردم به نام فلان
مگر باز گویند صاحبدلان
که سعدی که گوی بلاغت ربود
در ایام بوبکر بن سعد بود
سزد گر به دورش بنازم چنان
که سید به دوران نوشیروان
جهانبان دین پرور دادگر
نیامد چو بوبکر بعد از عمر
سر سرفرازان و تاج مهان
به دوران عدلش بناز، ای جهان
گر از فتنه آید کسی در پناه
ندارد جز این کشور آرامگاه
فطوبی لباب کبیت العتیق
حوالیه من کل فج عمیق
ندیدم چنین گنج و ملک و سریر
که وقف است بر طفل و درویش و پیر
نیامد برش دردناک غمی
که ننهاد بر خاطرش مرهمی
طلبکار خیر است امیدوار
خدایا امیدی که دارد برآر
کله گوشه بر آسمان برین
هنوز از تواضع سرش بر زمین
گدا گر تواضع کند خوی اوست
ز گردن فرازان تواضع نکوست
اگر زیردستی بیفتد چه خاست؟
زبردست افتاده مرد خداست
نه ذکر جمیلش نهان می‌رود
که صیت کرم در جهان می‌رود
چنویی خردمند فرخ نژاد
ندارد جهان تا جهان است، یاد
نبینی در ایام او رنجه‌ای
که نالد ز بیداد سرپنجه‌ای
کس این رسم و ترتیب و آیین ندید
فریدون با آن شکوه، این ندید
از آن پیش حق پایگاهش قوی است
که دست ضعیفان به جاهش قوی است
چنان سایه گسترده بر عالمی
که زالی نیندیشد از رستمی
همه وقت مردم ز جور زمان
بنالند و از گردش آسمان
در ایام عدل تو ای شهریار
ندارد شکایت کس از روزگار
به عهد تو می‌بینم آرام خلق
پس از تو ندانم سرانجام خلق
هم از بخت فرخنده فرجام توست
که تاریخ سعدی در ایام توست
که تا بر فلک ماه و خورشید هست
در این دفترت ذکر جاوید هست
ملوک ار نکو نامی اندوختند
ز پیشینگان سیرت آموختند
تو در سیرت پادشاهی خویش
سبق بردی از پادشاهان پیش
سکندر به دیوار رویین و سنگ
بکرد از جهان راه یأجوج تنگ
تو را سد یأجوج کفر از زر است
نه رویین چو دیوار اسکندر است
زبان آوری کاندر این امن و داد
سپاست نگوید زبانش مباد
زهی بحر بخشایش و کان جود
که مستظهرند از وجودت وجود
برون بینم اوصاف شاه از حساب
نگنجد در این تنگ میدان کتاب
گر آن جمله را سعدی انشا کند
مگر دفتری دیگر املا کند
فروماندم از شکر چندین کرم
همان به که دست دعا گسترم
جهانت به کام و فلک یار باد
جهان آفرینت نگهدار باد
بلند اخترت عالم افروخته
زوال اختر دشمنت سوخته
غم از گردش روزگارت مباد
وز اندیشه بر دل غبارت مباد
که بر خاطر پادشاهان غمی
پریشان کند خاطر عالمی
دل و کشورت جمع و معمور باد
ز ملکت پراکندگی دور باد
تنت باد پیوسته چون دین، درست
بداندیش را دل چو تدبیر، سست
درونت به تأیید حق شاد باد
دل و دین و اقلیمت آباد باد
جهان آفرین بر تو رحمت کناد
دگر هرچه گویم فسانه‌ست و باد
همینت بس از کردگار مجید
که توفیق خیرت بود بر مزید
نرفت از جهان سعد زنگی به درد
که چون تو خلف نامبردار کرد
عجب نیست این فرع از آن اصل پاک
که جانش بر اوج است و جسمش به خاک
خدایا بر آن تربت نامدار
به فضلت که باران رحمت ببار
گر از سعد زنگی مثل ماند یاد
فلک یاور سعد بوبکر باد"
saadi,boostan,"
شنیدم که در وقت نزع روان
به هرمز چنین گفت نوشیروان
که خاطر نگهدار درویش باش
نه در بند آسایش خویش باش
نیاساید اندر دیار تو کس
چو آسایش خویش جویی و بس
نیاید به نزدیک دانا پسند
شبان خفته و گرگ در گوسفند
برو پاس درویش محتاج دار
که شاه از رعیت بود تاجدار
رعیت چو بیخند و سلطان درخت
درخت، ای پسر، باشد از بیخ سخت
مکن تا توانی دل خلق ریش
وگر می‌کنی می‌کنی بیخ خویش
اگر جاده‌ای بایدت مستقیم
ره پارسایان امید است و بیم
طبیعت شود مرد را بخردی
به امید نیکی و بیم بدی
گر این هر دو در پادشه یافتی
در اقلیم و ملکش پنه یافتی
که بخشایش آرد بر امیدوار
به امید بخشایش کردگار
گزند کسانش نیاید پسند
که ترسد که در ملکش آید گزند
وگر در سرشت وی این خوی نیست
در آن کشور آسودگی بوی نیست
اگر پای بندی رضا پیش گیر
وگر یک سواری سر خویش گیر
فراخی در آن مرز و کشور مخواه
که دلتنگ بینی رعیت ز شاه
ز مستکبران دلاور بترس
از آن کاو نترسد ز داور بترس
دگر کشور آباد بیند به خواب
که دارد دل اهل کشور خراب
خرابی و بدنامی آید ز جور
رسد پیش بین این سخن را به غور
رعیت نشاید به بیداد کشت
که مر سلطنت را پناهند و پشت
مراعات دهقان کن از بهر خویش
که مزدور خوشدل کند کار بیش
مروت نباشد بدی با کسی
کز او نیکویی دیده باشی بسی
شنیدم که خسرو به شیرویه گفت
در آن دم که چشمش ز دیدن بخفت
بر آن باش تا هرچه نیت کنی
نظر در صلاح رعیت کنی
الا تا نپیچی سر از عدل و رای
که مردم ز دستت نپیچند پای
گریزد رعیت ز بیدادگر
کند نام زشتش به گیتی سمر
بسی بر نیاید که بنیاد خود
بکند آن که بنهاد بنیاد بد
خرابی کند مرد شمشیر زن
نه چندان که دود دل طفل و زن
چراغی که بیوه زنی برفروخت
بسی دیده باشی که شهری بسوخت
از آن بهره‌ورتر در آفاق کیست
که در ملکرانی به انصاف زیست
چو نوبت رسد زین جهان غربتش
ترحم فرستند بر تربتش
بد و نیک مردم چو می‌بگذرند
همان به که نامت به نیکی برند
خداترس را بر رعیت گمار
که معمار ملک است پرهیزگار
بد اندیش توست آن و خونخوار خلق
که نفع تو جوید در آزار خلق
ریاست به دست کسانی خطاست
که از دستشان دستها برخداست
نکوکارپرور نبیند بدی
چو بد پروری خصم خون خودی
مکافات موذی به مالش مکن
که بیخش برآورد باید ز بن
مکن صبر بر عامل ظلم دوست
که از فربهی بایدش کند پوست
سر گرگ باید هم اول برید
نه چون گوسفندان مردم درید
چه خوش گفت بازارگانی اسیر
چو گردش گرفتند دزدان به تیر
چو مردانگی آید از رهزنان
چه مردان لشکر، چه خیل زنان
شهنشه که بازارگان را بخست
در خیر بر شهر و لشکر ببست
کی آن جا دگر هوشمندان روند
چو آوازهٔ رسم بد بشنوند؟
نکو بایدت نام و نیکی قبول
نکو دار بازارگان و رسول
بزرگان مسافر به جان پرورند
که نام نکویی به عالم برند
تبه گردد آن مملکت عن قریب
کز او خاطر آزرده آید غریب
غریب آشنا باش و سیاح دوست
که سیاح جلاب نام نکوست
نکو دار ضیف و مسافر عزیز
وز آسیبشان بر حذر باش نیز
ز بیگانه پرهیز کردن نکوست
که دشمن توان بود در زی دوست
غریبی که پر فتنه باشد سرش
میازار و بیرون کن از کشورش
تو گر خشم بر وی نگیری رواست
که خود خوی بد دشمنش در قفاست
وگر پارسی باشدش زاد و بوم
به صنعاش مفرست و سقلاب و روم
هم آن جا امانش مده تا به چاشت
نشاید بلا بر دگر کس گماشت
که گویند برگشته باد آن زمین
کز او مردم آیند بیرون چنین
قدیمان خود را بیفزای قدر
که هرگز نیاید ز پرورده غدر
چو خدمتگزاریت گردد کهن
حق سالیانش فرامش مکن
گر او را هرم دست خدمت ببست
تو را بر کرم همچنان دست هست
شنیدم که شاپور دم در کشید
چو خسرو به رسمش قلم در کشید
چو شد حالش از بینوایی تباه
نبشت این حکایت به نزدیک شاه
چو بذل تو کردم جوانی خویش
به هنگام پیری مرانم ز پیش
عمل گر دهی مرد منعم شناس
که مفلس ندارد ز سلطان هراس
چو مفلس فرو برد گردن به دوش
از او بر نیاید دگر جز خروش
چو مشرف دو دست از امانت بداشت
بباید بر او ناظری بر گماشت
ور او نیز در ساخت با خاطرش
ز مشرف عمل بر کن و ناظرش
خدا ترس باید امانت گزار
امین کز تو ترسد امینش مدار
امین باید از داور اندیشناک
نه از رفع دیوان و زجر و هلاک
بیفشان و بشمار و فارغ نشین
که از صد یکی را نبینی امین
دو همجنس دیرینه را هم‌قلم
نباید فرستاد یک جا به هم
چه دانی که همدست گردند و یار
یکی دزد باشد، یکی پرده‌دار
چو دزدان ز هم باک دارند و بیم
رود در میان کاروانی سلیم
یکی را که معزول کردی ز جاه
چو چندی برآید ببخشش گناه
بر آوردن کام امیدوار
به از قید بندی شکستن هزار
نویسنده را گر ستون عمل
بیفتد، نبرد طناب امل
به فرمانبران بر شه دادگر
پدروار خشم آورد بر پسر
گهش می‌زند تا شود دردناک
گهی می‌کند آبش از دیده پاک
چو نرمی کنی خصم گردد دلیر
وگر خشم گیری شوند از تو سیر
درشتی و نرمی به هم در به است
چو رگ‌زن که جراح و مرهم نه است
جوانمرد و خوش خوی و بخشنده باش
چو حق بر تو پاشد تو بر خلق پاش
نیامد کس اندر جهان کاو بماند
مگر آن کز او نام نیکو بماند
نمرد آن که ماند پس از وی به جای
پل و خانی و خان و مهمان سرای
هر آن کاو نماند از پسش یادگار
درخت وجودش نیاورد بار
وگر رفت و آثار خیرش نماند
نشاید پس مرگش الحمد خواند
چو خواهی که نامت بود جاودان
مکن نام نیک بزرگان نهان
همین نقش بر خوان پس از عهد خویش
که دیدی پس از عهد شاهان پیش
همین کام و ناز و طرب داشتند
به آخر برفتند و بگذاشتند
یکی نام نیکو ببرد از جهان
یکی رسم بد ماند از او جاودان
به سمع رضا مشنو ایذای کس
وگر گفته آید به غورش برس
گنهکار را عذر نسیان بنه
چو زنهار خواهند زنهار ده
گر آید گنهکاری اندر پناه
نه شرط است کشتن به اول گناه
چو باری بگفتند و نشنید پند
بده گوشمالش به زندان و بند
وگر پند و بندش نیاید بکار
درختی خبیث است بیخش برآر
چو خشم آیدت بر گناه کسی
تأمل کنش در عقوبت بسی
که سهل است لعل بدخشان شکست
شکسته نشاید دگرباره بست"
